,major_city,state,city_state,geocode,city_latitude,city_longitude
11345,Apopka,FL,"Apopka, FL","Apopka, Orange County, Florida, United States",28.68,-81.51
11406,New Haven,VT,"New Haven, VT","New Haven, Addison County, Vermont, 05472, United States",44.12,-73.15
11414,Oxnard,CA,"Oxnard, CA","Oxnard, Ventura County, California, United States",34.2,-119.18
11436,Hemet,CA,"Hemet, CA","Hemet, Riverside County, California, United States",33.75,-116.97
11446,Hinesburg,VT,"Hinesburg, VT","Hinesburg, Chittenden County, Vermont, 05461, United States",44.33,-73.11
11517,Bedford,OH,"Bedford, OH","Bedford, Cuyahoga County, Ohio, 44146, United States",41.39,-81.54
11623,Temple Hills,MD,"Temple Hills, MD","Temple Hills, Prince George's County, Maryland, 20748, United States",38.81,-76.95
11639,Naples,FL,"Naples, FL","Naples, Collier County, Florida, United States",26.14,-81.79
11740,Berkeley,CA,"Berkeley, CA","Berkeley, Alameda County, California, United States",37.87,-122.27
11785,Saltville,VA,"Saltville, VA","Saltville, Smyth County, Virginia, United States",36.88,-81.76
11812,Castlewood,VA,"Castlewood, VA","Castlewood, Temple Hill, Russell County, Virginia, United States",36.88,-82.28
11825,Kingston,WA,"Kingston, WA","Kingston, Kitsap County, Washington, 98346, United States",47.8,-122.5
11886,Carlsbad,CA,"Carlsbad, CA","Carlsbad, San Diego County, California, United States",33.16,-117.35
11891,Arvada,CO,"Arvada, CO","Arvada, Jefferson County, Colorado, United States",39.8,-105.08
11925,Webster,TX,"Webster, TX","West Webster Street Park, Fourth Ward, Houston, Harris County, 77019, United States",29.75,-95.38
11986,Encino,CA,"Encino, CA","Encino, Los Angeles, Los Angeles County, California, 91436, United States",34.16,-118.5
12032,Jeffersonville,VT,"Jeffersonville, VT","Jeffersonville, Cambridge, Lamoille County, Vermont, 05464, United States",44.64,-72.83
12245,Concord,CA,"Concord, CA","Concord, Contra Costa County, California, United States",37.98,-122.03
12251,Yuba City,CA,"Yuba City, CA","Yuba City, Sutter County, California, United States",39.14,-121.62
12261,Viper,KY,"Viper, KY","Viper, Perry County, Kentucky, 41774, United States",37.18,-83.15
12473,Elmwood Park,IL,"Elmwood Park, IL","Elmwood Park, Leyden Township, Cook County, Illinois, United States",41.92,-87.82
12532,Hallandale,FL,"Hallandale, FL","Hallandale Beach, Broward County, Florida, 33009, United States",25.98,-80.15
12659,Stow,NY,"Stow, NY","Stow, Town of North Harmony, Chautauqua County, New York, 14785, United States",42.16,-79.4
12812,Lancaster,PA,"Lancaster, PA","Lancaster, Lancaster County, Pennsylvania, United States",40.04,-76.31
12816,Barney,GA,"Barney, GA","Barney, Brooks County, Georgia, United States",31.01,-83.51
12821,Bunnell,FL,"Bunnell, FL","Bunnell, Flagler County, Florida, 32110, United States",29.47,-81.26
12845,Greenbelt,MD,"Greenbelt, MD","Greenbelt, Spring Manor Drive, Greenbelt, Prince George's County, Maryland, 20770, United States",38.99,-76.88
12850,Bladensburg,MD,"Bladensburg, MD","Bladensburg, Prince George's County, Maryland, 20710, United States",38.94,-76.93
12855,Medford,OR,"Medford, OR","Medford, Jackson County, Oregon, United States",42.33,-122.87
12920,Waldorf,MD,"Waldorf, MD","Waldorf, Charles County, Maryland, 20601, United States",38.64,-76.91
13002,Cleveland,OK,"Cleveland, OK","Cleveland County, Oklahoma, United States",35.23,-97.31
13066,Hindman,KY,"Hindman, KY","Hindman, Knott County, Kentucky, United States",37.34,-82.98
13078,Fort Wayne,IN,"Fort Wayne, IN","Fort Wayne, Allen County, Indiana, United States",41.08,-85.14
13088,Newbury Park,CA,"Newbury Park, CA","Newbury Park, Thousand Oaks, Ventura County, California, 91320, United States",34.18,-118.91
13098,Winters,CA,"Winters, CA","Winters, Yolo County, California, United States",38.52,-121.97
13106,Upper Marlboro,MD,"Upper Marlboro, MD","Upper Marlboro, Prince George's County, Maryland, United States",38.81,-76.76
13155,River Rouge,MI,"River Rouge, MI","River Rouge, Wayne County, Michigan, 48218, United States",42.27,-83.14
13173,Marstons Mills,MA,"Marstons Mills, MA","Marstons Mills, Barnstable, Barnstable County, Massachusetts, 02648, United States",41.66,-70.42
13249,Belvidere,IL,"Belvidere, IL","Belvidere, Belvidere Township, Boone County, Illinois, 61008, United States",42.26,-88.84
13270,Ashville,NY,"Ashville, NY","Ashville, Town of North Harmony, Chautauqua County, New York, 14710, United States",42.1,-79.38
13403,Los Gatos,CA,"Los Gatos, CA","Los Gatos, Santa Clara County, California, 95030, United States",37.23,-121.97
13436,Rancho Cucamonga,CA,"Rancho Cucamonga, CA","Rancho Cucamonga, San Bernardino County, California, United States",34.1,-117.58
13512,Porter Ranch,CA,"Porter Ranch, CA","Porter Ranch, Los Angeles, Los Angeles County, California, 91326, United States",34.28,-118.56
13751,Rye,TX,"Rye, TX","TX 146, Big Thicket Creekmore Village, Rye, Liberty County, 77326, United States",30.47,-94.77
13836,Morgan Hill,CA,"Morgan Hill, CA","Morgan Hill, Santa Clara County, California, 95038, United States",37.13,-121.65
13924,Knightdale,NC,"Knightdale, NC","Knightdale, Wake County, North Carolina, 27545, United States",35.79,-78.48
14093,Christiana,TN,"Christiana, TN","Christiana, Rutherford County, Middle Tennessee, Tennessee, 37037, United States",35.71,-86.4
14165,Playa Del Rey,CA,"Playa Del Rey, CA","Playa del Rey, Los Angeles, Los Angeles County, California, 90293, United States",33.95,-118.44
14279,Timnath,CO,"Timnath, CO","Timnath, Larimer County, Colorado, 80547, United States",40.53,-104.98
14599,Palmer,TX,"Palmer, TX","Palmer, Ellis County, Texas, United States",32.43,-96.67
14614,Trenton,GA,"Trenton, GA","Trenton, Dade County, Georgia, United States",34.87,-85.51
14622,Biscoe,NC,"Biscoe, NC","Biscoe, Montgomery County, North Carolina, United States",35.36,-79.78
14723,Panorama City,CA,"Panorama City, CA","Panorama City, Panorama City Neighborhood Council District, Los Angeles, Los Angeles County, California, 91402, United States",34.22,-118.45
14754,Valdosta,GA,"Valdosta, GA","Valdosta, Lowndes County, Georgia, United States",30.83,-83.28
14800,Greenbrier,TN,"Greenbrier, TN","Greenbrier, Robertson County, Middle Tennessee, Tennessee, 37073, United States",36.43,-86.8
14946,Valley Village,CA,"Valley Village, CA","Valley Village, Los Angeles, Los Angeles County, California, 91607, United States",34.16,-118.4
14999,Wildwood,GA,"Wildwood, GA","Wildwood, Chicago, Jefferson Township, Cook County, Illinois, United States",42.0,-87.78
15261,San Mateo,CA,"San Mateo, CA","San Mateo County, California, United States",37.5,-122.33
15412,Anderson Island,WA,"Anderson Island, WA","Anderson Island, Pierce County, Washington, 98303, United States",47.16,-122.71
15460,Bowie,MD,"Bowie, MD","Bowie, Prince George's County, Maryland, United States",38.94,-76.73
15573,Delton,MI,"Delton, MI","Delton, Barry Township, Barry County, Michigan, 49046, United States",42.5,-85.41
15614,Scarsdale,NY,"Scarsdale, NY","Village of Scarsdale, Westchester County, New York, 10583, United States",40.99,-73.8
15659,Colchester,VT,"Colchester, VT","Colchester, Chittenden County, Vermont, 05446, United States",44.54,-73.21
15678,Roxbury Crossing,MA,"Roxbury Crossing, MA","Roxbury Crossing, Tremont Street, Mission Hill, Boston, Suffolk County, Massachusetts, 02120, United States",42.33,-71.1
15834,Fairfield,VT,"Fairfield, VT","Fairfield, Franklin County, Vermont, 05455, United States",44.8,-72.95
15863,Oxon Hill,MD,"Oxon Hill, MD","Oxon Hill, Prince George's County, Maryland, 20745, United States",38.78,-76.97
16000,Forest City,IA,"Forest City, IA","Forest City, Winnebago County, Iowa, 50436, United States",43.26,-93.64
16053,Santa Clara,CA,"Santa Clara, CA","Santa Clara County, California, United States",37.23,-121.68
16189,Benicia,CA,"Benicia, CA","Benicia, Solano County, California, 94510, United States",38.05,-122.16
16229,South Pasadena,CA,"South Pasadena, CA","South Pasadena, Los Angeles County, California, 91030, United States",34.11,-118.15
16301,Lyons,MI,"Lyons, MI","Lyons, Lyons Township, Cook County, Illinois, United States",41.81,-87.82
16423,Forestville,NY,"Forestville, NY","Forestville, Town of Hanover, Chautauqua County, New York, United States",42.47,-79.18
16513,Elk Grove,CA,"Elk Grove, CA","Elk Grove, Sacramento County, California, 95624, United States",38.41,-121.37
16649,Brush Prairie,WA,"Brush Prairie, WA","Brush Prairie, Battle Ground, Clark County, Washington, United States",45.73,-122.54
16682,East Berkshire,VT,"East Berkshire, VT","East Berkshire, Berkshire, Franklin County, Vermont, 05447, United States",44.93,-72.71
16719,Flintstone,GA,"Flintstone, GA","Flintstone, Walker County, Georgia, 30725, United States",34.94,-85.34
16740,Springfield,MO,"Springfield, MO","Springfield, Greene County, Missouri, United States",37.2,-93.29
16787,West Hills,CA,"West Hills, CA","West Hills, Los Angeles, Los Angeles County, California, 91307, United States",34.2,-118.65
16907,Bemus Point,NY,"Bemus Point, NY","Village of Bemus Point, Town of Ellery, Chautauqua County, New York, United States",42.16,-79.39
16913,Hillsborough,NC,"Hillsborough, NC","Hillsborough, Orange County, North Carolina, 27278, United States",36.08,-79.1
16965,Chautauqua,NY,"Chautauqua, NY","Chautauqua County, New York, United States",42.29,-79.42
17009,Aurora,IL,"Aurora, IL","Aurora, Aurora Township, Kane County, Illinois, United States",41.76,-88.31
17070,Clemmons,NC,"Clemmons, NC","Clemmons, Forsyth County, North Carolina, United States",36.02,-80.38
17089,Cambridge,MA,"Cambridge, MA","Cambridge, Middlesex County, Massachusetts, United States",42.38,-71.11
17190,Bremen,OH,"Bremen, OH","Bremen, Fairfield County, Ohio, United States",39.7,-82.43
17195,Dixon,CA,"Dixon, CA","Dixon, Solano County, California, 95620, United States",38.45,-121.82
17297,Cedar Bluff,VA,"Cedar Bluff, VA","Cedar Bluff, Tazewell County, Virginia, United States",37.09,-81.76
17351,Stanford,CA,"Stanford, CA","Stanford, Palo Alto, Santa Clara County, California, United States",37.43,-122.17
17570,Ferrisburgh,VT,"Ferrisburgh, VT","Ferrisburgh, Addison County, Vermont, United States",44.21,-73.25
17654,Sparks,NV,"Sparks, NV","Sparks, Washoe County, Nevada, United States",39.54,-119.75
17674,Hurst,TX,"Hurst, TX","Hurst, Tarrant County, Texas, United States",32.82,-97.17
17742,Williston,VT,"Williston, VT","Williston, Chittenden County, Vermont, 05495, United States",44.44,-73.07
17764,Addison,TX,"Addison, TX","Addison, Dallas County, Texas, 75001, United States",32.96,-96.83
17863,Temecula,CA,"Temecula, CA","Temecula, Riverside County, California, United States",33.49,-117.15
17974,Camas,WA,"Camas, WA","Camas, Clark County, Washington, 98607, United States",45.59,-122.4
18183,Santa Clarita,CA,"Santa Clarita, CA","Santa Clarita, Los Angeles County, California, United States",34.39,-118.54
18271,Parrish,FL,"Parrish, FL","Parrish, Manatee County, Florida, 34219, United States",27.59,-82.43
18286,Newark,OH,"Newark, OH","Newark, Licking County, Ohio, 43055, United States",40.06,-82.4
18379,Sunnyside,NY,"Sunnyside, NY","Sunnyside, Queens County, City of New York, New York, 11101, United States",40.74,-73.94
18383,Mattapan,MA,"Mattapan, MA","Mattapan, Boston, Suffolk County, Massachusetts, 02126, United States",42.27,-71.09
18407,Coldspring,TX,"Coldspring, TX","Coldspring, San Jacinto County, Texas, United States",30.59,-95.13
18496,Lafayette,IN,"Lafayette, IN","Lafayette, Tippecanoe County, Indiana, United States",40.42,-86.88
18524,Roslindale,MA,"Roslindale, MA","Roslindale, Boston, Suffolk County, Massachusetts, 02131, United States",42.29,-71.12
18808,Cattaraugus,NY,"Cattaraugus, NY","Cattaraugus County, New York, United States",42.22,-78.65
18810,Castroville,TX,"Castroville, TX","Castroville, Medina County, Texas, United States",29.36,-98.88
18990,Medina,WA,"Medina, WA","Medina, King County, Washington, 98039, United States",47.62,-122.23
19043,Lacey,WA,"Lacey, WA","Lacey, Thurston County, Washington, United States",47.03,-122.81
19224,Middleburg,FL,"Middleburg, FL","Middleburg, Clay County, Florida, United States",30.06,-81.9
19252,Hebron,OH,"Hebron, OH","Hebron, Union Township, Licking County, Ohio, 43025, United States",39.96,-82.49
19404,Fairfax,VA,"Fairfax, VA","Fairfax, Fairfax (city), Virginia, 20030, United States",38.85,-77.31
19405,Stokesdale,NC,"Stokesdale, NC","Stokesdale, Guilford County, North Carolina, United States",36.24,-79.98
19550,Sherman,NY,"Sherman, NY","Village of Sherman, Town of Sherman, Chautauqua County, New York, 14781, United States",42.16,-79.6
19566,Perry,ME,"Perry, ME","Perry, Washington County, Maine, United States",44.97,-67.08
19737,Santa Barbara,CA,"Santa Barbara, CA","Santa Barbara, Santa Barbara County, California, United States",34.42,-119.7
19801,The Colony,TX,"The Colony, TX","The Colony, Denton County, Texas, 75056, United States",33.09,-96.89
19856,Pfafftown,NC,"Pfafftown, NC","Pfafftown, Forsyth County, North Carolina, 27040, United States",36.15,-80.36
19895,Bristol,VA,"Bristol, VA","Bristol, Virginia, 37625, United States",36.6,-82.19
20554,Orting,WA,"Orting, WA","Orting, Pierce County, Washington, 98360, United States",47.1,-122.2
20954,Bronxville,NY,"Bronxville, NY","Village of Bronxville, Town of Eastchester, Westchester County, New York, 10708, United States",40.94,-73.83
20993,Riverview,FL,"Riverview, FL","Riverview, Hillsborough County, Florida, 33568, United States",27.87,-82.33
21045,Rowan,IA,"Rowan, IA","Rowan, Wright County, Iowa, United States",42.74,-93.55
21273,Cleburne,TX,"Cleburne, TX","Cleburne, Johnson County, Texas, United States",32.35,-97.39
21454,Milton,VT,"Milton, VT","Milton, Chittenden County, Vermont, 05468, United States",44.63,-73.12
21884,Waterville,VT,"Waterville, VT","Waterville, Lamoille County, Vermont, 05492, United States",44.69,-72.77
22012,Oakwood,GA,"Oakwood, GA","Oakwood, Hall County, Georgia, United States",34.23,-83.88
22026,Minnie,KY,"Minnie, KY","Minnie, Floyd County, Kentucky, 41651, United States",37.47,-82.75
22061,Kemah,TX,"Kemah, TX","Kemah, Galveston County, Texas, United States",29.54,-95.02
22086,Menifee,CA,"Menifee, CA","Menifee, Riverside County, California, 92584, United States",33.69,-117.18
22159,Glenford,OH,"Glenford, OH","Glenford, Perry County, Ohio, United States",39.89,-82.32
22444,Ventura,IA,"Ventura, IA","Ventura, Cerro Gordo County, Iowa, 50482, United States",43.13,-93.48
22498,Dickinson,TX,"Dickinson, TX","Dickinson, Galveston County, 77539, United States",29.46,-95.05
22592,Haines City,FL,"Haines City, FL","Haines City, Polk County, Florida, 33844, United States",28.11,-81.63
22761,Fife,WA,"Fife, WA","Fife, Pierce County, Washington, 98424, United States",47.24,-122.36
22837,Belton,TX,"Belton, TX","Belton, Bell County, Texas, United States",31.06,-97.46
22907,Euless,TX,"Euless, TX","Euless, Tarrant County, Texas, United States",32.85,-97.07
22918,Canutillo,TX,"Canutillo, TX","Doniphan Drive, Serene Acres Colonia, Canutillo, El Paso County, 79821, United States",31.91,-106.6
22924,Richmond Hill,NY,"Richmond Hill, NY","Richmond Hill, Queens County, City of New York, New York, 11418, United States",40.7,-73.83
22942,Stafford,TX,"Stafford, TX","Stafford Run Road, Stafford, Fort Bend County, Texas, 77477, United States",29.61,-95.56
23127,Washingtonville,OH,"Washingtonville, OH","Washingtonville, Columbiana County, Ohio, 44490, United States",40.9,-80.76
23228,Porter,TX,"Porter, TX","Gladys Porter Zoo, Polk Street, Brownsville, Cameron County, 78520, United States",25.91,-97.5
23272,Saint George,UT,"Saint George, UT","East Saint George Boulevard, St. George, Washington County, Utah, 84771, United States",37.11,-113.57
23279,Lowell,MI,"Lowell, MI","Lowell, Middlesex County, Massachusetts, United States",42.64,-71.31
23376,Sunfield,MI,"Sunfield, MI","Sunfield, Sunfield Township, Eaton County, Michigan, United States",42.76,-84.99
23383,Valencia,CA,"Valencia, CA","Valencia, Parroquia Santa Rosa, Municipio Valencia, Carabobo, 2001, Venezuela",10.17,-68.0
23406,Holland,MI,"Holland, MI","Holland, Ottawa County, Michigan, 49423, United States",42.79,-86.11
23443,Stockton,NY,"Stockton, NY","Town of Stockton, Chautauqua County, New York, United States",42.32,-79.36
23525,Flint,MI,"Flint, MI","Flint, Genesee County, Michigan, United States",43.02,-83.69
23609,Greenhurst,NY,"Greenhurst, NY","Greenhurst, Town of Ellery, Chautauqua County, New York, 14742, United States",42.12,-79.31
23651,Floral Park,NY,"Floral Park, NY","Village of Floral Park, Town of Hempstead, Nassau County, New York, 11001, United States",40.72,-73.7
23653,Clintwood,VA,"Clintwood, VA","Clintwood, Dickenson County, Virginia, United States",37.15,-82.46
23680,Reading,PA,"Reading, PA","Reading, Berks County, Pennsylvania, United States",40.34,-75.93
24207,Fort Washington,MD,"Fort Washington, MD","Fort Washington, Prince George's County, Maryland, United States",38.74,-77.0
24332,Port Isabel,TX,"Port Isabel, TX","Port Isabel, Cameron County, Texas, 78578, United States",26.07,-97.21
24367,Bristol,VT,"Bristol, VT","Bristol, Addison County, Vermont, United States",44.13,-73.08
24403,,WA,,"Nanno, Ville d'Anaunia, Comunità della Val di Non, Provincia di Trento, Trentino-Alto Adige/Südtirol, 38093, Italia",46.31,11.05
24461,Stoutsville,OH,"Stoutsville, OH","Stoutsville, Fairfield County, Ohio, United States",39.6,-82.83
24580,Rockville,MD,"Rockville, MD","Rockville, Montgomery County, Maryland, United States",39.08,-77.15
24805,Newberry,FL,"Newberry, FL","Newberry, Alachua County, Florida, United States",29.65,-82.61
25172,Kernersville,NC,"Kernersville, NC","Kernersville, Forsyth County, North Carolina, 27284, United States",36.12,-80.07
25234,Ponte Vedra,FL,"Ponte Vedra, FL","Ponte Vedra Beach, Saint Johns County, Florida, United States",30.23,-81.38
25335,Wellsville,OH,"Wellsville, OH","Wellsville, Columbiana County, Ohio, United States",40.6,-80.65
25442,Lebanon,VA,"Lebanon, VA","Lebanon, Russell County, Virginia, 24266, United States",36.9,-82.08
25452,Glendale,OR,"Glendale, OR","Glendale, Douglas County, Oregon, 97442, United States",42.74,-123.42
25474,Gardena,CA,"Gardena, CA","Gardena, Los Angeles County, California, United States",33.9,-118.31
25484,Kensington,MD,"Kensington, MD","Kensington, Montgomery County, Maryland, 20895, United States",39.03,-77.08
25668,Eagle,MI,"Eagle, MI","Eagle County, Colorado, United States",39.62,-106.72
25675,Richford,VT,"Richford, VT","Richford, Franklin County, Vermont, 05476, United States",45.0,-72.67
25715,Splendora,TX,"Splendora, TX","Splendora, Montgomery County, Texas, 77372, United States",30.23,-95.16
25813,North Hills,CA,"North Hills, CA","North Hills, Northridge East Neighborhood Council District, Los Angeles, Los Angeles County, California, 91343, United States",34.24,-118.49
25906,Mountain View,CA,"Mountain View, CA","Mountain View, Santa Clara County, California, United States",37.39,-122.08
25944,Winooski,VT,"Winooski, VT","Winooski, Chittenden County, Vermont, 05404, United States",44.49,-73.19
26162,Steilacoom,WA,"Steilacoom, WA","Steilacoom, Pierce County, Washington, 98388, United States",47.17,-122.6
26169,Dearborn Heights,MI,"Dearborn Heights, MI","Dearborn Heights, Wayne County, Michigan, United States",42.34,-83.27
26195,Intercession City,FL,"Intercession City, FL","Intercession City, Osceola County, Florida, 33848, United States",28.26,-81.51
26285,Maspeth,NY,"Maspeth, NY","Maspeth, Queens County, City of New York, New York, 11378, United States",40.72,-73.91
26432,Falcon Heights,TX,"Falcon Heights, TX","Falcon Heights Drive, Coles Crossing, Harris County, Texas, 77429, United States",29.98,-95.67
26606,Clinchco,VA,"Clinchco, VA","Clinchco, Dickenson County, Virginia, United States",37.16,-82.36
26654,Quitman,GA,"Quitman, GA","Quitman County, Georgia, United States",31.88,-85.02
26792,Essex,NY,"Essex, NY","Essex County, New York, United States",44.06,-73.75
26943,Altadena,CA,"Altadena, CA","Altadena, Los Angeles County, California, 91001, United States",34.19,-118.14
27251,Burke,VA,"Burke, VA","Burke, Fairfax County, Virginia, 22015, United States",38.78,-77.27
27261,Latimer,IA,"Latimer, IA","Latimer, Franklin County, Iowa, United States",42.76,-93.37
27525,Brentwood,MD,"Brentwood, MD","Brentwood, Prince George's County, Maryland, 20722, United States",38.94,-76.96
27604,New Palestine,IN,"New Palestine, IN","New Palestine, Hancock County, Indiana, United States",39.72,-85.89
27692,Alden,IA,"Alden, IA","Alden, Hardin County, Iowa, United States",42.52,-93.38
27715,Fort Mill,SC,"Fort Mill, SC","Fort Mill, York County, South Carolina, United States",35.01,-80.95
27845,Mount Hamilton,CA,"Mount Hamilton, CA","Mount Hamilton, Santa Clara County, California, 95140, United States",37.34,-121.64
27906,Red Oak,TX,"Red Oak, TX","Red Oak, Cleburne, Johnson County, Texas, 76033, United States",32.33,-97.42
28029,Saint Paul,VA,"Saint Paul, VA","Saint-Paul, Beaupréau-en-Mauges, Cholet, Beaupréau, Maine-et-Loire, Pays de la Loire, France métropolitaine, 49600, France",47.24,-1.01
28045,Indian Trail,NC,"Indian Trail, NC","Indian Trail, Union County, North Carolina, United States",35.08,-80.67
28255,Riverdale,MD,"Riverdale, MD","Riverdale Park, Prince George's County, Maryland, United States",38.96,-76.93
28490,Glendale,KY,"Glendale, KY","Glendale, Hardin County, Kentucky, 42740, United States",37.6,-85.91
28544,Mebane,NC,"Mebane, NC","Mebane, Alamance County, North Carolina, United States",36.1,-79.27
28778,Stanton,TX,"Stanton, TX","TX 137, Stanton, Martin County, Texas, 79782, United States",32.31,-101.86
28882,Manor,TX,"Manor, TX","Manor, Travis County, Texas, 78653, United States",30.34,-97.56
29052,Westport,NY,"Westport, NY","Town of Westport, Essex County, New York, 12993, United States",44.18,-73.44
29170,Bahama,NC,"Bahama, NC","Bahama, Durham County, North Carolina, United States",36.17,-78.88
29391,Buckley,WA,"Buckley, WA","Buckley, Pierce County, Washington, United States",47.16,-122.03
29420,Kalamazoo,MI,"Kalamazoo, MI","Kalamazoo, Kalamazoo County, Michigan, United States",42.29,-85.59
29438,Amanda,OH,"Amanda, OH","Amanda, Fairfield County, Ohio, United States",39.65,-82.74
29472,Mount Rainier,MD,"Mount Rainier, MD","Mount Rainier, Prince George's County, Maryland, 20712, United States",38.94,-76.96
29721,Fort Myers,FL,"Fort Myers, FL","Fort Myers, Lee County, Florida, United States",26.64,-81.87
29921,Conewango Valley,NY,"Conewango Valley, NY","Conewango Valley, Town of Ellington, Chautauqua County, New York, 14726, United States",42.24,-79.06
30261,,CA,,"Nanno, Ville d'Anaunia, Comunità della Val di Non, Provincia di Trento, Trentino-Alto Adige/Südtirol, 38093, Italia",46.31,11.05
30422,Corning,OH,"Corning, OH","Corning, Perry County, Ohio, United States",39.6,-82.09
30465,Ogden,UT,"Ogden, UT","Ogden, Weber County, Utah, United States",41.22,-111.97
31232,Orleans,MI,"Orleans, MI","Orleans County, New York, United States",43.22,-78.23
31373,Port Wentworth,GA,"Port Wentworth, GA","Port Wentworth, Chatham County, Georgia, 31407, United States",32.15,-81.16
31728,Napa,CA,"Napa, CA","Napa, Napa County, California, United States",38.3,-122.29
31832,Waterville,ME,"Waterville, ME","Waterville, Kennebec County, Maine, United States",44.55,-69.63
31915,Allston,MA,"Allston, MA","Allston, Boston, Suffolk County, Massachusetts, United States",42.36,-71.13
31943,Dunkirk,NY,"Dunkirk, NY","Dunkirk, City of Dunkirk, Chautauqua County, New York, 14048, United States",42.48,-79.33
32031,Meadowview,VA,"Meadowview, VA","Meadowview, Roanoke, Virginia, 24012, United States",37.32,-79.92
32128,Belmont,NC,"Belmont, NC","Belmont, Gaston County, North Carolina, 28012, United States",35.24,-81.04
32254,Montgomery Center,VT,"Montgomery Center, VT","Montgomery Center, Montgomery, Franklin County, Vermont, 05471, United States",44.88,-72.61
32325,Logan,UT,"Logan, UT","Logan, Cache County, Utah, United States",41.73,-111.83
32432,Olney,MD,"Olney, MD","Olney, Montgomery County, Maryland, United States",39.15,-77.07
32491,Centerville,MA,"Centerville, MA","Centerville, Appanoose County, Iowa, 52544, United States",40.73,-92.87
32658,Montrose,CA,"Montrose, CA","Montrose, Greater Highlands, Edmonton, Division No. 11, Alberta, Canada",53.57,-113.44
32678,Sunland,CA,"Sunland, CA","Sunland, Los Angeles, Los Angeles County, California, 91042, United States",34.27,-118.3
32683,Forney,TX,"Forney, TX","Forney, Kaufman County, Texas, 75126, United States",32.75,-96.47
32894,Belding,MI,"Belding, MI","Belding, Ionia County, Michigan, United States",43.1,-85.23
33194,Logan,OH,"Logan, OH","Logan County, Ohio, United States",40.44,-83.74
33204,Potterville,MI,"Potterville, MI","Potterville, Eaton County, Michigan, 48876, United States",42.63,-84.74
33319,West Roxbury,MA,"West Roxbury, MA","West Roxbury, Boston, Suffolk County, Massachusetts, 02132, United States",42.28,-71.15
33782,New Lexington,OH,"New Lexington, OH","New Lexington, Perry County, Ohio, United States",39.71,-82.21
33925,Sun Valley,NV,"Sun Valley, NV","Sun Valley, Washoe County, Nevada, 89433, United States",39.61,-119.78
34115,Richards,TX,"Richards, TX","Richards, Grimes County, Texas, United States",30.54,-95.84
34197,New Richmond,OH,"New Richmond, OH","New Richmond, Ohio Township, Clermont County, Ohio, United States",38.95,-84.28
34414,North Ferrisburgh,VT,"North Ferrisburgh, VT","North Ferrisburgh, Ferrisburgh, Addison County, Vermont, 05473, United States",44.26,-73.21
34503,San Pablo,CA,"San Pablo, CA","San Pablo, Contra Costa County, California, 94806, United States",37.96,-122.35
34763,Fort Oglethorpe,GA,"Fort Oglethorpe, GA","Fort Oglethorpe, Catoosa County, Georgia, 30742, United States",34.95,-85.24
35520,Johnson,VT,"Johnson, VT","Johnson, Lamoille County, Vermont, 05656, United States",44.64,-72.68
35688,Cedar Park,TX,"Cedar Park, TX","Cedar Park, Williamson County, Texas, United States",30.52,-97.83
