,city_state,geocode,city_latitude,city_longitude,city,state
92679,"Mayfield Village, OH","Mayfield Cemetery, Coventry Village, Cleveland Heights, Cuyahoga County, Ohio, United States",41.51,-81.58,Mayfield Village,OH
92783,"Saranac Vlg, MI",,,,Saranac Vlg,MI
92816,"Sunrise Manor, NV","Sunrise Manor, Clark County, Nevada, United States",36.18,-115.03,Sunrise Manor,NV
92873,"Old Mill Basin, NY",,,,Old Mill Basin,NY
92983,"Other City Value Out Of Area, FL",,,,Other City Value Out Of Area,FL
93158,"Cassadaga, NY","Village of Cassadaga, Town of Stockton, Chautauqua County, New York, United States",42.34,-79.31,Cassadaga,NY
93177,"Dolgeville, NY","Village of Dolgeville, Town of Manheim, Herkimer County, New York, 13329, United States",43.1,-74.77,Dolgeville,NY
93221,"Meservey, IA","Meservey, Cerro Gordo County, Iowa, United States",42.91,-93.48,Meservey,IA
93463,"E. New York, NY","East New York, Brooklyn, Kings County, City of New York, New York, 11208, United States",40.67,-73.88,E. New York,NY
93536,"Drift, KY","Drift, Floyd County, Kentucky, 41651, United States",37.48,-82.75,Drift,KY
93911,"BELLE ISLE, FL","Belle Isle, Orange County, Florida, United States",28.46,-81.36,BELLE ISLE,FL
93949,"Asheville City, NC","Asheville City Hall, Davidson Street, South Slope, Asheville, Buncombe County, North Carolina, 28802, United States",35.6,-82.55,Asheville City,NC
94049,"Black Diamond, WA","Black Diamond, King County, Washington, 98010, United States",47.31,-122.0,Black Diamond,WA
94169,"Englewood, CO","Englewood, Arapahoe County, Colorado, 80110, United States",39.65,-104.99,Englewood,CO
94564,"Grants Pass, OR","Grants Pass, Josephine County, Oregon, United States",42.44,-123.33,Grants Pass,OR
95164,"Mountain Springs, NV","Mountain Springs, Clark County, Nevada, United States",36.02,-115.51,Mountain Springs,NV
95850,"St. George, UT","St. George, Washington County, Utah, United States",37.1,-113.58,St. George,UT
95988,"Hernando County, FL","Hernando County, Florida, United States",28.57,-82.46,Hernando County,FL
96547,"DuPont, WA","DuPont, Pierce County, Washington, 98327, United States",47.1,-122.64,DuPont,WA
97110,"Other City Value - Out Of Area, TX",,,,Other City Value - Out Of Area,TX
97359,"Okahumpka, FL","Okahumpka, Lake County, Florida, United States",28.75,-81.9,Okahumpka,FL
97474,"Mangonia Park, FL","Mangonia Park, Palm Beach County, Florida, United States",26.76,-80.07,Mangonia Park,FL
97898,"Granville, OH","Granville, Granville Township, Licking County, Ohio, 43023, United States",40.07,-82.52,Granville,OH
97985,"Romayor, TX",,,,Romayor,TX
98060,"Highland, MD","Highland, Howard County, Maryland, 20777, United States",39.18,-76.96,Highland,MD
98420,"Arden, NC","Arden, Asheville, Buncombe County, North Carolina, 28707, United States",35.47,-82.52,Arden,NC
98636,"Bellevue, TN","Bellevue, King County, Washington, United States",47.61,-122.19,Bellevue,TN
98684,"Swords Creek, VA","Swords Creek, Russell County, Virginia, 24649, United States",37.04,-81.92,Swords Creek,VA
98826,"Woodfin, NC","Woodfin, Buncombe County, North Carolina, United States",35.63,-82.58,Woodfin,NC
99254,"Huntington, VT","Huntington, Chittenden County, Vermont, 05462, United States",44.33,-72.99,Huntington,VT
99742,"Alviso, CA","Alviso, San Jose, Santa Clara County, California, 95002, United States",37.43,-121.98,Alviso,CA
100636,"Hallsville, TX","Hallsville City Park, Hallsville, Harrison County, 75650, United States",32.51,-94.57,Hallsville,TX
100689,"Cherry Valley, MA","Cherry Valley, Rockford Township, Winnebago County, Illinois, United States",42.24,-88.96,Cherry Valley,MA
100873,"Pt Charlotte, FL","Port Charlotte, Charlotte County, Florida, United States",26.98,-82.11,Pt Charlotte,FL
101009,"Chestnut Hill, MA","Chestnut Hill, Newton, Middlesex County, Massachusetts, 02138, United States",42.33,-71.17,Chestnut Hill,MA
101515,"Lizella, GA","Lizella, Macon, Bibb County, Georgia, 31052, United States",32.81,-83.82,Lizella,GA
101780,"Flint, TX","Flint, Smith County, Texas, United States",32.2,-95.35,Flint,TX
101867,"Dante, VA","Dante, Russell County, Virginia, 24237, United States",36.98,-82.3,Dante,VA
102610,"WINTER PARK, FL","Winter Park, Orange County, Florida, United States",28.6,-81.35,WINTER PARK,FL
102699,"Belllingham, WA",,,,Belllingham,WA
103159,"Jeff, KY","Jeff, Perry County, Kentucky, 41751, United States",37.21,-83.14,Jeff,KY
103290,"Eagle Lake, FL","Eagle Lake, Polk County, Florida, 33839, United States",27.98,-81.76,Eagle Lake,FL
103585,"Palmyra, TN","Palmyra, Montgomery County, Middle Tennessee, Tennessee, 37142, United States",36.44,-87.49,Palmyra,TN
103619,"Pleasanton, TX","Pleasanton, Atascosa County, 78064, United States",28.97,-98.48,Pleasanton,TX
103905,"Emigration Canyon, UT","Emigration Canyon, Salt Lake County, Utah, United States",40.77,-111.76,Emigration Canyon,UT
105166,"Elmwood Place, OH","Elmwood Place, Hamilton County, Ohio, United States",39.19,-84.49,Elmwood Place,OH
105422,"SPRING HILL, FL","Spring Hill, Hernando County, Florida, United States",28.48,-82.53,SPRING HILL,FL
105567,"Liberty, TX","Liberty County, Texas, United States",30.09,-94.79,Liberty,TX
105629,"CAPE HAZE, FL","Cape Haze, Charlotte County, Florida, 33946, United States",26.85,-82.29,CAPE HAZE,FL
106179,"Spring Valley, NV","Spring Valley, Clark County, Nevada, United States",36.11,-115.24,Spring Valley,NV
106257,"Fultonham, OH","Fultonham, Muskingum County, Ohio, 43738, United States",39.86,-82.14,Fultonham,OH
107068,"Bed-Stuy, NY","Bedford-Stuyvesant, Brooklyn, Kings County, City of New York, New York, 11216, United States",40.68,-73.94,Bed-Stuy,NY
108096,"Silver Creek, NY","Village of Silver Creek, Town of Hanover, Chautauqua County, New York, 14136, United States",42.54,-79.17,Silver Creek,NY
108465,"Other, NV","Tahoe Rim Trail: a Trail Like No Other, Tamarack Lake Trail, Washoe County, Nevada, United States",39.31,-119.9,Other,NV
108623,"Lorena, TX","Lorena, McLennan County, Texas, United States",31.39,-97.22,Lorena,TX
108628,"Mead, WA","Mead, Spokane County, Washington, 99021, United States",47.77,-117.35,Mead,WA
108636,"Matlacha Isles, FL","Matlacha Isles-Matlacha Shores, Cape Coral, Lee County, Florida, United States",26.63,-82.06,Matlacha Isles,FL
109203,"Fulshear, TX","Fulshear, Fort Bend County, Texas, United States",29.69,-95.9,Fulshear,TX
109337,"Fort Pierce, FL","Fort Pierce, Saint Lucie County, Florida, United States",27.45,-80.33,Fort Pierce,FL
109809,"Breezy Point, NY","Breezy Point, Queens County, City of New York, New York, United States",40.56,-73.93,Breezy Point,NY
110935,"Bermuda Dunes, CA","Bermuda Dunes, Palm Desert, Riverside County, California, United States",33.74,-116.29,Bermuda Dunes,CA
110988,"Greenacres, WA","Greenacres, Spokane Valley, Spokane County, Washington, 99307, United States",47.66,-117.16,Greenacres,WA
111501,"Browns Summit, NC","Browns Summit, Guilford County, North Carolina, 27214, United States",36.21,-79.71,Browns Summit,NC
111863,"Sharonville, OH","Sharonville, Hamilton County, Ohio, 45241, United States",39.27,-84.41,Sharonville,OH
111894,"Martinez, GA","Martinez, Wynngate, Columbia County, Georgia, United States",33.52,-82.09,Martinez,GA
112074,"Brighton, MA","Brighton, East Sussex, England, BN1 1HH, United Kingdom",50.82,-0.14,Brighton,MA
112760,"Clarksville, MI","Clarksville, Montgomery County, Middle Tennessee, Tennessee, United States",36.53,-87.36,Clarksville,MI
112817,"Hollywood Hills East, CA","Cahuenga Boulevard East, Hollywood Hills, Los Angeles, Los Angeles County, California, 90068, United States",34.13,-118.34,Hollywood Hills East,CA
112941,"Tamarac, Fl","Tamarac, Broward County, Florida, United States",26.21,-80.25,Tamarac,Fl
112955,"Forest City, NC","Forest City, Rutherford County, North Carolina, 28043, United States",35.33,-81.86,Forest City,NC
113214,"Yarrow Point, WA","Yarrow Point, King County, Washington, United States",47.65,-122.22,Yarrow Point,WA
113873,"Geddes, NY","Town of Geddes, Onondaga County, New York, United States",43.08,-76.23,Geddes,NY
114138,"Williamsburg, NY","Williamsburg, Brooklyn, Kings County, City of New York, New York, 11249, United States",40.71,-73.95,Williamsburg,NY
114850,"Newtown, OH","Newtown, Hamilton County, Ohio, United States",39.12,-84.36,Newtown,OH
115630,"Rye, CO","City of Rye, Westchester County, New York, United States",40.98,-73.68,Rye,CO
116866,"Schertz, TX","Schertz, Guadalupe County, Texas, 78154, United States",29.56,-98.27,Schertz,TX
117499,"Castle Hayne, NC","Castle Hayne, New Hanover County, North Carolina, United States",34.35,-77.91,Castle Hayne,NC
117847,"El Cenizo, TX","El Cenizo, Webb County, Texas, United States",27.33,-99.5,El Cenizo,TX
119403,"West Ashville, NC","Ashville Road, Baltic Wharf, Ashton Gate, Bristol, City of Bristol, West of England, England, BS3 2AP, United Kingdom",51.44,-2.62,West Ashville,NC
120065,"Lake Los Angeles, CA","Lake Los Angeles, Los Angeles County, California, 93591, United States",34.61,-117.83,Lake Los Angeles,CA
120346,"St. Johns, FL","Saint Johns County, Florida, United States",29.9,-81.41,St. Johns,FL
120561,"Rural Hall, NC","Rural Hall, Forsyth County, North Carolina, 27045, United States",36.24,-80.29,Rural Hall,NC
120695,"Olalla, WA","Olalla, Kitsap County, Washington, 98359, United States",47.43,-122.54,Olalla,WA
121263,"Lyon Township, MI","Lyon Township, Roscommon County, Michigan, 48627, United States",44.48,-84.79,Lyon Township,MI
121308,"Jarrell, TX","Jarrell, Williamson County, Texas, 76537, United States",30.82,-97.6,Jarrell,TX
121324,"Anaheim Hills, CA","Anaheim Hills, Anaheim, Orange County, California, 92807, United States",33.84,-117.78,Anaheim Hills,CA
121457,"Rio Hondo, TX","Rio Hondo, Cameron County, Texas, United States",26.24,-97.58,Rio Hondo,TX
121681,"Poteet, TX","Poteet, Atascosa County, Texas, United States",29.04,-98.57,Poteet,TX
121955,"Hanoverton, OH","Hanoverton, Columbiana County, Ohio, United States",40.75,-80.94,Hanoverton,OH
122469,"Ceresco, MI","Ceresco, Marshall Township, Calhoun County, Michigan, United States",42.27,-85.06,Ceresco,MI
122615,"Blue Diamond, NV","Blue Diamond, Clark County, Nevada, 89004, United States",36.05,-115.41,Blue Diamond,NV
122892,"Fairfax Station, VA","Fairfax Station, Fairfax County, Virginia, 22032, United States",38.8,-77.33,Fairfax Station,VA
123123,"Kimberlin Heights, TN","Kimberlin Heights, Knox County, East Tennessee, Tennessee, 37998, United States",35.93,-83.75,Kimberlin Heights,TN
123217,"Dayton, TN","Dayton, Rhea County, East Tennessee, Tennessee, 37321, United States",35.49,-85.01,Dayton,TN
123534,"Richlands, NC","Richlands, Onslow County, North Carolina, United States",34.9,-77.55,Richlands,NC
123775,"Selma, TX","Selma, Bexar County, Texas, United States",29.58,-98.31,Selma,TX
124352,"Pt Arthur, TX","Port Arthur, Jefferson County, Texas, United States",29.9,-93.93,Pt Arthur,TX
124546,"San Leon, TX","Vineyard Church of San Antonio, Bandera Road, Leon Valley, Bexar County, Texas, 78238, United States",29.48,-98.59,San Leon,TX
124773,"Cleveland, UT","Cleveland, Emery County, Utah, United States",39.35,-110.85,Cleveland,UT
125054,"Georgetown, FL","Georgetown, Putnam County, Florida, 32139, United States",29.39,-81.64,Georgetown,FL
125455,"Dows, IA","Dows, Wright County, Iowa, United States",42.66,-93.5,Dows,IA
125467,"BRANDON, FL","Brandon, Hillsborough County, Florida, United States",27.93,-82.29,BRANDON,FL
125811,"Taylor Landing, TX","Taylor Landing, Jefferson County, Texas, United States",29.87,-94.14,Taylor Landing,TX
126175,"Point Richmond, CA","Point Richmond, Richmond, Contra Costa County, California, 94801, United States",37.92,-122.39,Point Richmond,CA
126277,"Johns, FL","Johns, Jacksonville, Duval County, Florida, United States",30.31,-81.61,Johns,FL
126330,"White Plains, MD","White Plains, Charles County, Maryland, 20603, United States",38.59,-76.94,White Plains,MD
127582,"Whallonsburg, NY","Whallonsburg, Town of Essex, Essex County, New York, 12936, United States",44.26,-73.4,Whallonsburg,NY
127907,"Accokeek, MD","Accokeek, Prince George's County, Maryland, 20607, United States",38.66,-76.99,Accokeek,MD
128389,"Woodland, GA","Woodland, Talbot County, Georgia, United States",32.79,-84.56,Woodland,GA
128629,"Magna, UT","Magna, Salt Lake County, Utah, United States",40.7,-112.08,Magna,UT
129599,"Flatbush, NY","Flatbush, Brooklyn, Kings County, City of New York, New York, 11226, United States",40.65,-73.96,Flatbush,NY
129699,,"Nanno, Ville d'Anaunia, Comunit della Val di Non, Provincia di Trento, Trentino-Alto Adige/Sdtirol, 38093, Italia",46.31,11.05,,
129880,"Mendota, VA","Mendota, Washington County, Virginia, 24258, United States",36.71,-82.3,Mendota,VA
131118,"Encinal, TX","I 35 Business;TX 44, Encinal, La Salle County, United States",28.05,-99.35,Encinal,TX
131396,"Santa Fe, TX","Santa Fe, Galveston County, United States",29.38,-95.11,Santa Fe,TX
131411,"Glendale, OH","Glendale, Hamilton County, Ohio, United States",39.27,-84.46,Glendale,OH
131632,"Arrington, TN","Arrington, Williamson County, Middle Tennessee, Tennessee, United States",35.87,-86.71,Arrington,TN
132745,"Ochlocknee, GA","Ochlocknee, Thomas County, Georgia, United States",30.97,-84.05,Ochlocknee,GA
132752,"San Benito, TX","San Benito, Irving, Dallas County, Texas, 75039, United States",32.91,-96.94,San Benito,TX
132942,"Thompson, IA","Thompson, Winnebago County, Iowa, United States",43.37,-93.77,Thompson,IA
133471,"Lisle, IL","Lisle, DuPage County, Illinois, United States",41.8,-88.07,Lisle,IL
133554,"Kenwood, CA","Kenwood, Sonoma County, California, 95442, United States",38.41,-122.55,Kenwood,CA
133834,"Saint Lucie West, FL","Paradise Villas of Saint Lucie West, Port Saint Lucie, Saint Lucie County, Florida, United States",27.32,-80.38,Saint Lucie West,FL
133997,"Lake worth, TX","Lake Worth, Tarrant County, Texas, United States",32.8,-97.45,Lake worth,TX
134105,"Caldwell, NC","Caldwell County, North Carolina, United States",35.94,-81.53,Caldwell,NC
134341,"Bexar Co, TX","Bexar Metro Area Engineer and Maintenance Facility, San Antonio, Bexar County, 78223, United States",29.32,-98.42,Bexar Co,TX
134488,"Los Altos Hills, CA","Los Altos Hills, Santa Clara County, California, United States",37.38,-122.14,Los Altos Hills,CA
134743,"Sunset Valley, TX","Sunset Valley, Travis County, Texas, United States",30.23,-97.81,Sunset Valley,TX
134792,"New Albany, OH","New Albany, Plain Township, Franklin County, Ohio, 43054, United States",40.08,-82.81,New Albany,OH
134852,"Kagel Canyon, CA","Kagel Canyon, Los Angeles, Los Angeles County, California, United States",34.31,-118.38,Kagel Canyon,CA
135416,"South Houston, TX","PIOLA HOUSTON MEMORIAL, TX, 1415, South Voss Road, Houston, Harris County, Texas, 77057, United States",29.75,-95.5,South Houston,TX
135763,"Sansom Park, TX","Sansom Park, Tarrant County, Texas, United States",32.81,-97.4,Sansom Park,TX
135804,"Walton Hills, OH","Walton Hills, Cuyahoga County, Ohio, United States",41.37,-81.56,Walton Hills,OH
136499,"Highland, CA","Highland, San Bernardino County, California, United States",34.11,-117.18,Highland,CA
136716,"FORT COLLINS, CO","Fort Collins, Larimer County, Colorado, United States",40.55,-105.07,FORT COLLINS,CO
136872,"Virginia Gardens, FL","Virginia Gardens, Miami-Dade County, Florida, 33266, United States",25.81,-80.3,Virginia Gardens,FL
136961,"Suwannee, FL","Suwannee County, Florida, United States",30.21,-82.99,Suwannee,FL
137560,"Doctor Philips, FL",,,,Doctor Philips,FL
137788,"Opa-Locka, FL","Opa-locka, Miami-Dade County, Florida, 33054, United States",25.9,-80.25,Opa-Locka,FL
138399,"Alys Beach, FL","Alys Beach, Walton County, Florida, 32461, United States",30.28,-86.03,Alys Beach,FL
138777,"Pierce Township, OH","Pierce Township, Clermont County, Ohio, United States",39.02,-84.26,Pierce Township,OH
138949,"Elizabethton, TN","Elizabethton, Carter County, East Tennessee, Tennessee, United States",36.35,-82.21,Elizabethton,TN
139068,"Hyde Park, VT","Hyde Park, Lamoille County, Vermont, United States",44.59,-72.62,Hyde Park,VT
139160,"Riverdale, NY","Riverdale, Bronx County, The Bronx, City of New York, New York, 10471, United States",40.9,-73.91,Riverdale,NY
139939,"NASHVILLE, TN","Nashville-Davidson, Davidson County, Middle Tennessee, Tennessee, United States",36.16,-86.77,NASHVILLE,TN
139953,"Midland, NC","Midland, Cabarrus County, North Carolina, 28107, United States",35.23,-80.5,Midland,NC
140477,"Richmond, VT","Richmond, Chittenden County, Vermont, 05477, United States",44.41,-72.99,Richmond,VT
140717,"Clarksville, MD","Clarksville, Howard County, Maryland, 21029, United States",39.21,-76.94,Clarksville,MD
140814,"Cuyahoga, OH","Cuyahoga County, Ohio, United States",41.43,-81.69,Cuyahoga,OH
141231,"Jamaica Estates, NY","Jamaica Estates, Midland Parkway, Hillside, Queens, City of New York, New York, 11432, United States",40.71,-73.78,Jamaica Estates,NY
141695,"Lorton, VA","Lorton, Fairfax County, Virginia, United States",38.7,-77.24,Lorton,VA
141709,"Highway 30, TX",,,,Highway 30,TX
141983,"Newfane, VT","Newfane, Windham County, Vermont, United States",42.99,-72.66,Newfane,VT
143183,"Sassafras, KY","Sassafras, Knott County, Kentucky, 41773, United States",37.22,-83.06,Sassafras,KY
143338,"Stowe, PA","Stowe, West Pottsgrove, Montgomery County, Pennsylvania, 19465, United States",40.25,-75.68,Stowe,PA
143410,"Bonaire, GA","Bonaire, Pedrafita, Guitiriz, Terra Ch, Lugo, Galicia, 27389, Espaa",43.14,-7.76,Bonaire,GA
143826,"RIVERVIEW, FL","Riverview, Hillsborough County, Florida, 33568, United States",27.87,-82.33,RIVERVIEW,FL
144220,"Sloan, NY","Village of Sloan, Town of Cheektowaga, Erie County, New York, United States",42.9,-78.79,Sloan,NY
145582,"Lincoln, VT","Lincoln, Addison County, Vermont, 05443, United States",44.11,-73.0,Lincoln,VT
146406,"Labelle, FL","LaBelle, Hendry County, Florida, 33935, United States",26.76,-81.44,Labelle,FL
146503,"Rockbridge, OH","Rockbridge, Hocking County, Ohio, 43149, United States",39.58,-82.52,Rockbridge,OH
146930,"Botines, TX",,,,Botines,TX
147059,"Redford Township, MI","Redford Charter Township, Wayne County, Michigan, 48239, United States",42.39,-83.3,Redford Township,MI
147140,"Hillsborough, NC","Hillsborough, Orange County, North Carolina, 27278, United States",36.08,-79.1,Hillsborough,NC
147200,"Lincoln Heights, CA","Lincoln Heights, Los Angeles, Los Angeles County, California, 90031, United States",34.07,-118.21,Lincoln Heights,CA
147920,"Gerlach, NV","Gerlach, Washoe County, Nevada, United States",40.65,-119.36,Gerlach,NV
148291,"Leona valley, CA","Leona Valley, Los Angeles County, California, United States",34.62,-118.29,Leona valley,CA
148720,"Houston, PA","Houston County, Alabama, United States",31.14,-85.27,Houston,PA
148847,"Gulf Hammock, FL","Gulf Hammock, Levy County, Florida, 32625, United States",29.18,-83.01,Gulf Hammock,FL
148908,"Brookside Vl, TX",,,,Brookside Vl,TX
149120,"Sheepshead Bay, NY","Sheepshead Bay, Brooklyn, Kings County, City of New York, New York, 11235, United States",40.59,-73.94,Sheepshead Bay,NY
149992,"Whitsett, NC","Whitsett, Guilford County, North Carolina, United States",36.07,-79.56,Whitsett,NC
150269,"Shasta, CA","Shasta County, California, United States",40.8,-122.0,Shasta,CA
150392,"Sunset Park, NY","Sunset Park, Kings County, City of New York, New York, United States",40.64,-74.01,Sunset Park,NY
150456,"Brooklyn Heights, OH","Brooklyn Heights, Cuyahoga County, Ohio, United States",41.42,-81.68,Brooklyn Heights,OH
150647,"Merrifield, VA","Merrifield, Fairfax County, Virginia, United States",38.88,-77.24,Merrifield,VA
151037,"Thornton, IA","Thornton, Cerro Gordo County, Iowa, 50479, United States",42.94,-93.38,Thornton,IA
151515,"Bedford, MI","Bedford County, Middle Tennessee, Tennessee, United States",35.51,-86.45,Bedford,MI
151886,"Brookline, MA","Brookline, Norfolk County, Massachusetts, United States",42.33,-71.12,Brookline,MA
152344,"Golden Acres, TX","Golden Acres Home, Centerville Road, Dallas, Dallas County, Texas, 75228, United States",32.84,-96.67,Golden Acres,TX
153108,"EDGEWATER, CO","Edgewater, Bergen County, New Jersey, 07020, United States",40.83,-73.98,EDGEWATER,CO
154019,"Sundance, UT","Sundance Circle, Bloomington Hills, St. George, Washington County, Utah, 84790, United States",37.08,-113.57,Sundance,UT
154182,"Winchester, NV","Winchester, Clark County, Nevada, United States",36.13,-115.12,Winchester,NV
154439,"Candor, NC","Candor, Montgomery County, North Carolina, United States",35.3,-79.75,Candor,NC
155373,"New Straitsville, OH","New Straitsville, Perry County, Ohio, United States",39.58,-82.24,New Straitsville,OH
155493,"Nolanville, TX","Nolanville, Bell County, Texas, 76559, United States",31.08,-97.61,Nolanville,TX
158461,"Eaton Rapids, MI","Eaton Rapids, Eaton County, Michigan, 48827, United States",42.51,-84.66,Eaton Rapids,MI
158727,"Tega Cay, SC","Tega Cay, York County, South Carolina, United States",35.02,-81.03,Tega Cay,SC
158898,"Grand prairie, TX","Grand Prairie, Dallas County, Texas, United States",32.75,-97.0,Grand prairie,TX
159381,"Richwood, TX","Richwood, Brazoria County, Texas, United States",29.06,-95.41,Richwood,TX
159920,"Piedmont, CA","Piedmont, Alameda County, California, 94611, United States",37.82,-122.23,Piedmont,CA
160167,"Rockwell, IA","Rockwell, Cerro Gordo County, Iowa, United States",42.99,-93.19,Rockwell,IA
160187,"Glenn Dale, MD","Glenn Dale, Prince George's County, Maryland, United States",38.98,-76.8,Glenn Dale,MD
160291,"Jacinto City, TX","Jacinto City, Harris County, United States",29.77,-95.23,Jacinto City,TX
160821,"Milpitas, CA","Milpitas, Santa Clara County, California, 95035, United States",37.43,-121.9,Milpitas,CA
161473,"Lily Dale, NY","Lily Dale, Town of Pomfret, Chautauqua County, New York, 14752, United States",42.35,-79.32,Lily Dale,NY
162312,"Sherman Vlg, CA","Shermanstraat, Het Dorp, Oostham, Ham, Hasselt, Limburg, Vlaanderen, 3945, Belgi / Belgique / Belgien",51.1,5.18,Sherman Vlg,CA
162544,"Dimondale, MI","Dimondale, Windsor Charter Township, Eaton County, Michigan, United States",42.65,-84.65,Dimondale,MI
162545,"Nome, TX","Nome, Jefferson County, Texas, United States",30.04,-94.42,Nome,TX
163179,"Langley, KY","Langley, Floyd County, Kentucky, 41645, United States",37.53,-82.79,Langley,KY
163434,"Biola, CA","Biola, Fresno County, California, 93606, United States",36.8,-120.02,Biola,CA
163585,"Lehigh acres, FL","Lehigh Acres, Lee County, Florida, United States",26.61,-81.65,Lehigh acres,FL
163652,"Fairmount Heights, MD","Fairmount Heights, Prince George's County, Maryland, United States",38.9,-76.91,Fairmount Heights,MD
163984,"Bensalem, PA","Bensalem Township, Bucks County, Pennsylvania, United States",40.1,-74.95,Bensalem,PA
164470,"Allston, MA","Allston, Boston, Suffolk County, Massachusetts, United States",42.36,-71.13,Allston,MA
165002,"Kennedy, NY","Kennedy, Town of Poland, Chautauqua County, New York, 14747, United States",42.16,-79.1,Kennedy,NY
165487,"Wrightsville Beach, NC","Wrightsville Beach, New Hanover County, North Carolina, United States",34.21,-77.8,Wrightsville Beach,NC
165657,"SAINT JOHNS, FL","Saint Johns County, Florida, United States",29.9,-81.41,SAINT JOHNS,FL
166044,"Dunedin, FL","Dunedin, Pinellas County, Florida, 34698, United States",28.02,-82.77,Dunedin,FL
166557,"Kendall, FL","Kendall, Miami-Dade County, Florida, United States",25.67,-80.35,Kendall,FL
167334,"McDowell, KY","McDowell, Floyd County, Kentucky, 41647, United States",37.46,-82.74,McDowell,KY
167484,"Junction City, OH","Junction City, Perry County, Ohio, United States",39.72,-82.3,Junction City,OH
167641,"Quartz Hill, CA","Quartz Hill, Los Angeles County, California, United States",34.65,-118.22,Quartz Hill,CA
167878,"Leburn, KY","Leburn, Knott County, Kentucky, 41822, United States",37.35,-82.96,Leburn,KY
168498,"Stanwood, WA","Stanwood, Cedar County, Iowa, United States",41.89,-91.15,Stanwood,WA
168547,"Security, TX","Security, Cleburne, Johnson County, Texas, 76033, United States",32.34,-97.41,Security,TX
168698,"Downs, IL","Downs, McLean County, Illinois, United States",40.4,-88.87,Downs,IL
168795,"EVERGREEN, CO","Evergreen, Conecuh County, Alabama, 36401, United States",31.43,-86.96,EVERGREEN,CO
168986,"Shiro, TX","Shiro, Grimes County, Texas, United States",30.61,-95.89,Shiro,TX
169106,"Brant, NY","Town of Brant, Erie County, New York, United States",42.59,-79.02,Brant,NY
169837,"Charlotte, NY","Town of Charlotte, Chautauqua County, New York, 14782, United States",42.3,-79.23,Charlotte,NY
171126," , BA",Bosna i Hercegovina /   ,44.31,17.6, ,BA
171186,"Dixie, GA","Dixie, Macon, Bibb County, Georgia, 31220, United States",32.87,-83.76,Dixie,GA
172243,"Jonesville, FL","Jonesville, Alachua County, Florida, 32669, United States",29.65,-82.52,Jonesville,FL
172472,"Augusta, MI","Augusta, Richmond County, Georgia, United States",33.47,-81.97,Augusta,MI
172931,"CHARLOTTE, NC","Charlotte, Mecklenburg County, North Carolina, United States",35.23,-80.84,CHARLOTTE,NC
173285,"St Albans City, VT",,,,St Albans City,VT
173802,"Bullard, TX","Bullard Kids Park, Bullard, Smith County, 75757, United States",32.14,-95.33,Bullard,TX
174587,"Paradise, NV","Paradise, Clark County, Nevada, United States",36.12,-115.17,Paradise,NV
174626,"New Waterford, OH","New Waterford, Columbiana County, Ohio, 44445, United States",40.85,-80.61,New Waterford,OH
175214,"ALTAMONTE SPRINGS, FL","Altamonte Springs, Seminole County, Florida, United States",28.66,-81.39,ALTAMONTE SPRINGS,FL
175218,"Mayfield, OH","Mayfield, Cuyahoga County, Ohio, United States",41.54,-81.44,Mayfield,OH
175481,"Grapevine, TX","Grapevine, Tarrant County, Texas, 76051, United States",32.93,-97.08,Grapevine,TX
176247,"Lawrenceville, PA","Lawrenceville, Central Lawrenceville, Pittsburgh, Allegheny County, Pennsylvania, 15224, United States",40.47,-79.96,Lawrenceville,PA
177171,"JEFFERSON, CO","Jefferson County, Colorado, United States",39.57,-105.26,JEFFERSON,CO
