,major_city,state,city_state,geocode,city_latitude,city_longitude
35932,Boston,GA,"Boston, GA","Boston, Thomas County, Georgia, United States",30.79,-83.79
36019,Galena Park,TX,"Galena Park, TX","Galena Park Library, Clinton Drive, Galena Park, Harris County, 77029, United States",29.73,-95.24
36134,Mc Gregor,TX,"Mc Gregor, TX","Mc Gregor Drive, The Village, Austin, Travis County, Texas, 78715, United States",30.21,-97.81
36538,Laurelville,OH,"Laurelville, OH","Laurelville, Hocking County, Ohio, United States",39.47,-82.74
36895,Cassadaga,NY,"Cassadaga, NY","Village of Cassadaga, Town of Stockton, Chautauqua County, New York, United States",42.34,-79.31
36936,Cedar Valley,UT,"Cedar Valley, UT","Cedar Point, Apple Valley, Washington County, Utah, United States",37.05,-113.08
36953,Poulsbo,WA,"Poulsbo, WA","Poulsbo, Kitsap County, Washington, United States",47.74,-122.64
37144,Seabeck,WA,"Seabeck, WA","Seabeck Creek, Kitsap County, Washington, United States",47.61,-122.85
37200,South Dayton,NY,"South Dayton, NY","Village of South Dayton, Town of Dayton, Cattaraugus County, New York, United States",42.36,-79.06
37266,Bakersfield,VT,"Bakersfield, VT","Bakersfield, Franklin County, Vermont, 05441, United States",44.78,-72.8
37317,Nashport,OH,"Nashport, OH","Nashport, Muskingum County, Ohio, United States",40.07,-82.18
37384,Cypress,CA,"Cypress, CA","Cypress, Orange County, California, 90630, United States",33.82,-118.04
37694,Alto,MI,"Alto, MI","Alto, Mill Valley, Marin County, California, 94941, United States",37.9,-122.53
38133,Muir,MI,"Muir, MI","Muir, Lyons Township, Ionia County, Michigan, United States",43.0,-84.94
38236,Brocton,NY,"Brocton, NY","Village of Brocton, Town of Portland, Chautauqua County, New York, 14716, United States",42.39,-79.44
38323,Galloway,OH,"Galloway, OH","Galloway, Prairie Township, Franklin County, Ohio, 43119, United States",39.91,-83.16
38514,Nickelsville,VA,"Nickelsville, VA","Nickelsville, Scott County, Virginia, United States",36.75,-82.41
38538,Hilliard,OH,"Hilliard, OH","Hilliard, Norwich Township, Franklin County, Ohio, United States",40.03,-83.16
38764,Cuyahoga Falls,OH,"Cuyahoga Falls, OH","Cuyahoga Falls, Summit County, Ohio, United States",41.13,-81.48
38865,Mc Leansville,NC,"Mc Leansville, NC","Mc Leansville Road, Guilford County, North Carolina, 27214, United States",36.21,-79.69
38887,Jamestown,NC,"Jamestown, NC","Jamestown, Guilford County, North Carolina, United States",35.99,-79.94
38938,San Lorenzo,CA,"San Lorenzo, CA","San Lorenzo, Alameda County, California, United States",37.67,-122.13
39129,Stanley,NC,"Stanley, NC","Stanley, Gaston County, North Carolina, United States",35.36,-81.1
39195,Mill Spring,NC,"Mill Spring, NC","Mill Spring, Polk County, North Carolina, 28756, United States",35.3,-82.16
39477,Wake Forest,NC,"Wake Forest, NC","Wake Forest, Wake County, North Carolina, 27588, United States",35.98,-78.51
39759,Mesquite,TX,"Mesquite, TX","Mesquite, Dallas County, Texas, United States",32.77,-96.6
40075,Candler,NC,"Candler, NC","Candler, Buncombe County, North Carolina, 28715, United States",35.54,-82.69
40106,Narrowsburg,NY,"Narrowsburg, NY","Narrowsburg, Town of Tusten, Sullivan County, New York, United States",41.61,-75.06
40505,Manchaca,TX,"Manchaca, TX","Manchaca Village Apartments, Austin, Travis County, Texas, 78704, United States",30.24,-97.79
40551,Burleson,TX,"Burleson, TX","Burleson County, Texas, United States",30.48,-96.64
40582,Argyle,TX,"Argyle, TX","Argyle, Denton County, Texas, United States",33.11,-97.18
40848,Kilgore,TX,"Kilgore, TX","Kilgore, Cameron County, Texas, United States",26.1,-97.68
41097,Queen City,TX,"Queen City, TX","Queen City, Cass County, United States",33.15,-94.15
41174,Inglewood,CA,"Inglewood, CA","Inglewood, Los Angeles County, California, United States",33.96,-118.35
41414,Scranton,PA,"Scranton, PA","Scranton, Lackawanna County, Pennsylvania, United States",41.41,-75.66
41421,Cleveland,VA,"Cleveland, VA","Cleveland, Russell County, Virginia, United States",36.94,-82.15
42089,Crockett,CA,"Crockett, CA","Crockett, Contra Costa County, California, 94525, United States",38.04,-122.21
42167,San Gabriel,CA,"San Gabriel, CA","San Gabriel, Los Angeles County, California, United States",34.1,-118.11
42169,Morrisville,VT,"Morrisville, VT","Morrisville, Morristown, Lamoille County, Vermont, 05661, United States",44.56,-72.6
42362,Little Valley,NY,"Little Valley, NY","Village of Little Valley, Town of Little Valley, Cattaraugus County, New York, 14755, United States",42.25,-78.81
42438,Sinclairville,NY,"Sinclairville, NY","Village of Sinclairville, Town of Charlotte, Chautauqua County, New York, 14782, United States",42.26,-79.26
42590,Glouster,OH,"Glouster, OH","Glouster, Athens County, Ohio, United States",39.5,-82.08
42879,Raven,VA,"Raven, VA","Raven, Tazewell County, Virginia, United States",37.1,-81.86
43144,Graham,NC,"Graham, NC","Graham, Alamance County, North Carolina, 27352, United States",36.07,-79.4
43770,Little Elm,TX,"Little Elm, TX","Little Elm, Denton County, Texas, 75068, United States",33.16,-96.94
43787,Apison,TN,"Apison, TN","Apison, Hamilton County, East Tennessee, Tennessee, 37302, United States",35.02,-85.02
44977,Leander,TX,"Leander, TX","Leander, Williamson County, Texas, 78641, United States",30.57,-97.86
45198,Leetonia,OH,"Leetonia, OH","Leetonia, Columbiana County, Ohio, United States",40.88,-80.76
45246,Ocoee,FL,"Ocoee, FL","Ocoee, Orange County, Florida, 34761, United States",28.57,-81.54
45429,Hyannis,MA,"Hyannis, MA","Hyannis, Barnstable, Barnstable County, Massachusetts, 02601, United States",41.65,-70.28
45539,Coulter,IA,"Coulter, IA","Coulter, Franklin County, Iowa, 50431, United States",42.74,-93.37
45680,Lookout Mountain,TN,"Lookout Mountain, TN","Lookout Mountain, Hamilton County, East Tennessee, Tennessee, 37350, United States",34.99,-85.35
45695,Seabrook,TX,"Seabrook, TX","Seabrook, Harris County, 77586, United States",29.56,-95.02
46016,Zanesville,OH,"Zanesville, OH","Zanesville, Muskingum County, Ohio, 43701, United States",39.94,-82.01
46026,Maitland,FL,"Maitland, FL","Maitland, Orange County, Florida, 32751, United States",28.63,-81.37
46143,Riverdale,IL,"Riverdale, IL","Riverdale, Thornton Township, Cook County, Illinois, 60827, United States",41.63,-87.63
46569,College Park,MD,"College Park, MD","College Park, Prince George's County, Maryland, United States",38.98,-76.94
46574,Redondo Beach,CA,"Redondo Beach, CA","Redondo Beach, Los Angeles County, California, 90278, United States",33.85,-118.39
46779,Ypsilanti,MI,"Ypsilanti, MI","Ypsilanti, Washtenaw County, Michigan, 48197, United States",42.24,-83.61
46869,Smyrna,TN,"Smyrna, TN","Smyrna, Rutherford County, Middle Tennessee, Tennessee, 37167, United States",35.98,-86.52
46956,San Fernando,CA,"San Fernando, CA","San Fernando, Los Angeles County, California, 91340, United States",34.28,-118.44
47118,East Fairfield,VT,"East Fairfield, VT","East Fairfield, Fairfield, Franklin County, Vermont, United States",44.78,-72.86
47404,Brandywine,MD,"Brandywine, MD","Brandywine, Prince George's County, Maryland, 20613, United States",38.69,-76.88
47614,Springport,MI,"Springport, MI","Springport, Springport Township, Jackson County, Michigan, 49284, United States",42.38,-84.7
47618,Olivet,MI,"Olivet, MI","Olivet, Eaton County, Michigan, United States",42.44,-84.92
47636,Crooksville,OH,"Crooksville, OH","Crooksville, Perry County, Ohio, United States",39.77,-82.09
47684,Chapel Hill,NC,"Chapel Hill, NC","Chapel Hill, Orange County, North Carolina, United States",35.91,-79.06
47862,Cypress,TX,"Cypress, TX","Cypress, Harris County, 77433, United States",29.97,-95.7
48096,Emmalena,KY,"Emmalena, KY","Emmalena, Knott County, Kentucky, 41743, United States",37.34,-83.08
48393,Springfield,VA,"Springfield, VA","Springfield, Fairfax County, Virginia, 22150, United States",38.78,-77.18
49274,Bellevue,MI,"Bellevue, MI","Bellevue, King County, Washington, United States",47.61,-122.19
50256,Beaverton,OR,"Beaverton, OR","Beaverton, Washington County, Oregon, United States",45.49,-122.8
50745,Sunset Beach,CA,"Sunset Beach, CA","Sunset Beach (summer village), Alberta, Canada",54.74,-113.54
50953,Dripping Springs,TX,"Dripping Springs, TX","Dripping Springs Drive, Mineral Springs, Keller, Tarrant County, Texas, 76248, United States",32.94,-97.23
51004,Vermontville,MI,"Vermontville, MI","Vermontville, Vermontville Township, Eaton County, Michigan, United States",42.63,-85.02
51087,Jonesborough,TN,"Jonesborough, TN","Jonesborough, Washington County, East Tennessee, Tennessee, 37659, United States",36.29,-82.47
51186,Kingston,OH,"Kingston, OH","Kingston, Ross County, Ohio, United States",39.47,-82.91
51305,Newport Coast,CA,"Newport Coast, CA","Newport Coast, Newport Beach, Orange County, California, United States",33.6,-117.83
51688,Jackson,KY,"Jackson, KY","Jackson County, Kentucky, United States",37.42,-83.99
51781,Somerset,TX,"Somerset, TX","Somerset, Bexar County, Texas, United States",29.23,-98.66
52206,Buckeye Lake,OH,"Buckeye Lake, OH","Buckeye Lake, Union Township, Licking County, Ohio, 43008, United States",39.93,-82.48
52897,Conover,NC,"Conover, NC","Conover, Catawba County, North Carolina, 28613, United States",35.71,-81.22
52931,Columbia,MD,"Columbia, MD","Columbia, Howard County, Maryland, United States",39.19,-76.86
53123,Sumner,WA,"Sumner, WA","Sumner, Bremer County, Iowa, United States",42.85,-92.1
53396,Dacono,CO,"Dacono, CO","Dacono, Weld County, Colorado, 80514, United States",40.08,-104.94
54105,Fertile,IA,"Fertile, IA","Fertile, Worth County, Iowa, 50434, United States",43.26,-93.42
54189,Zionsville,IN,"Zionsville, IN","Zionsville, Boone County, Indiana, 46077, United States",39.95,-86.26
54237,Needmore,TN,"Needmore, TN","Needmore, Hamblen County, East Tennessee, Tennessee, 37891, United States",36.3,-83.16
54735,Waverly Hall,GA,"Waverly Hall, GA","Waverly Hall, Harris County, Georgia, 31831, United States",32.68,-84.74
54782,Grundy,VA,"Grundy, VA","Grundy, Buchanan County, Virginia, 24614, United States",37.28,-82.1
55140,Havana,FL,"Havana, FL","Havana, Gadsden County, Florida, United States",30.63,-84.42
55257,Bonnyman,KY,"Bonnyman, KY","Bonnyman, Perry County, Kentucky, 41719, United States",37.29,-83.24
55475,Frewsburg,NY,"Frewsburg, NY","Frewsburg, Town of Carroll, Chautauqua County, New York, 14738, United States",42.05,-79.16
56992,Dwarf,KY,"Dwarf, KY","Dwarf, Perry County, Kentucky, 41739, United States",37.34,-83.13
57342,Huntington,UT,"Huntington, UT","Huntington, Emery County, Utah, 84528, United States",39.33,-110.96
58028,Troutman,NC,"Troutman, NC","Troutman, Iredell County, North Carolina, United States",35.7,-80.89
59147,Mousie,KY,"Mousie, KY","Mousie, Knott County, Kentucky, 41839, United States",37.42,-82.88
59152,Hopewell,OH,"Hopewell, OH","Hopewell, Muskingum County, Ohio, 43746, United States",39.96,-82.17
59176,Roy,WA,"Roy, WA","Roy, Pierce County, Washington, United States",47.0,-122.54
59951,Orrtanna,PA,"Orrtanna, PA","Orrtanna, Adams County, Pennsylvania, United States",39.85,-77.36
59954,Duncanville,TX,"Duncanville, TX","Duncanville, Dallas County, Texas, United States",32.65,-96.91
60233,Leominster,MA,"Leominster, MA","Leominster, Worcester County, Massachusetts, 01453, United States",42.53,-71.76
60707,Garner,NC,"Garner, NC","Garner, Wake County, North Carolina, United States",35.71,-78.61
60867,Yeaddiss,KY,"Yeaddiss, KY","Yeaddiss, Leslie County, Kentucky, 41777, United States",37.07,-83.22
60949,Clint,TX,"Clint, TX","Clint, El Paso County, Texas, 79836, United States",31.59,-106.23
61179,Kannapolis,NC,"Kannapolis, NC","Kannapolis, Cabarrus County, North Carolina, United States",35.49,-80.62
61387,Tuckahoe,NY,"Tuckahoe, NY","Village of Tuckahoe, Town of Eastchester, Westchester County, New York, United States",40.95,-73.83
61982,Pacific,WA,"Pacific, WA","Pacific County, Washington, United States",46.53,-123.77
62741,Del Valle,TX,"Del Valle, TX","Basilica of our Lady of San Juan del Valle National Shrine, San Juan, Hidalgo County, 78589, United States",26.2,-98.16
63126,Rising Fawn,GA,"Rising Fawn, GA","Rising Fawn, Dade County, Georgia, United States",34.76,-85.53
63535,Dowling,MI,"Dowling, MI","Dowling, Baltimore Township, Barry County, Michigan, 49050, United States",42.52,-85.25
63685,Thurston,OH,"Thurston, OH","Thurston, Fairfield County, Ohio, 43157, United States",39.84,-82.55
63714,Dunn Loring,VA,"Dunn Loring, VA","Dunn Loring, Fairfax County, Virginia, 22027, United States",38.89,-77.23
63938,Edwards,IL,"Edwards, IL","Edwards County, Illinois, United States",38.41,-88.06
64140,Saranac,MI,"Saranac, MI","Saranac, Boston Township, Ionia County, Michigan, United States",42.93,-85.21
64146,Muskegon,MI,"Muskegon, MI","Muskegon, Muskegon County, Michigan, United States",43.23,-86.25
64231,Bessemer City,NC,"Bessemer City, NC","Bessemer City, Gaston County, North Carolina, United States",35.28,-81.28
64824,Rosedale,VA,"Rosedale, VA","Rosedale, Monongalia County, West Virginia, 26504, United States",39.69,-79.97
65287,South Hero,VT,"South Hero, VT","South Hero, Grand Isle County, Vermont, 05486, United States",44.65,-73.3
65368,Lancaster,TX,"Lancaster, TX","Lancaster, Dallas County, Texas, United States",32.59,-96.76
65835,Mukilteo,WA,"Mukilteo, WA","Mukilteo, Snohomish County, Washington, United States",47.95,-122.3
66269,Seaside,CA,"Seaside, CA","Seaside, Monterey County, California, 93955, United States",36.63,-121.82
66299,Crouse,NC,"Crouse, NC","Crouse, Lincoln County, North Carolina, 28033, United States",35.42,-81.31
66446,Grand Isle,VT,"Grand Isle, VT","Grand Isle County, Vermont, United States",44.71,-73.3
66490,Morrisville,NC,"Morrisville, NC","Morrisville, Wake County, North Carolina, 27650, United States",35.82,-78.83
66851,Piney Flats,TN,"Piney Flats, TN","Piney Flats, Sullivan County, East Tennessee, Tennessee, 37686, United States",36.42,-82.3
67276,Campbell,CA,"Campbell, CA","Campbell, Santa Clara County, California, United States",37.29,-121.94
67461,Tustin,CA,"Tustin, CA","Tustin, Orange County, California, United States",33.75,-117.83
67518,Seagoville,TX,"Seagoville, TX","Federal Correctional Institution Seagoville, 2113, North Highway 175, Seagoville, Dallas County, Texas, 75159, United States",32.65,-96.57
68107,Westford,VT,"Westford, VT","Westford, Chittenden County, Vermont, 05494, United States",44.61,-73.01
68356,Kirkersville,OH,"Kirkersville, OH","Kirkersville, Harrison Township, Licking County, Ohio, 43033, United States",39.96,-82.6
68638,New River,AZ,"New River, AZ","New River, Phoenix, Maricopa County, Arizona, 85080, United States",33.89,-112.09
69367,Lamont,FL,"Lamont, FL","Lamont, Jefferson County, Florida, United States",30.38,-83.81
69659,Coeburn,VA,"Coeburn, VA","Coeburn, Wise County, Virginia, 24230, United States",36.94,-82.46
69946,Belmond,IA,"Belmond, IA","Belmond, Wright County, Iowa, United States",42.85,-93.61
70709,Roseville,OH,"Roseville, OH","Roseville, Perry County, Ohio, United States",39.81,-82.08
70892,Maple Valley,WA,"Maple Valley, WA","Maple Valley, King County, Washington, 98038, United States",47.37,-122.04
71047,Eaton Park,FL,"Eaton Park, FL","Eaton Park, Polk County, Florida, 33840, United States",28.01,-81.91
72721,Lake Lure,NC,"Lake Lure, NC","Lake Lure, Rutherford County, North Carolina, 28746, United States",35.43,-82.2
73188,Icard,NC,"Icard, NC","Icard, Burke County, North Carolina, 28666, United States",35.73,-81.47
73202,Milton,WA,"Milton, WA","Milton, Van Buren County, Iowa, United States",40.67,-92.16
73220,Ponte Vedra Beach,FL,"Ponte Vedra Beach, FL","Ponte Vedra Beach, Saint Johns County, Florida, 32250, United States",30.24,-81.39
74528,Canyon,TX,"Canyon, TX","Canyon, Randall County, 79016, United States",34.98,-101.92
74934,Clarksburg,CA,"Clarksburg, CA","Clarksburg, The Blue Mountains, Grey County, Ontario, N0H 1J0, Canada",44.55,-80.47
75464,Laurel,MD,"Laurel, MD","Laurel, Prince George's County, Maryland, 20707, United States",39.1,-76.85
75657,Rushville,OH,"Rushville, OH","Rushville, Fairfield County, Ohio, United States",39.76,-82.43
75689,Alvin,TX,"Alvin, TX","Alvin, Brazoria County, Texas, United States",29.42,-95.24
75818,Seffner,FL,"Seffner, FL","Seffner, Hillsborough County, Florida, 33584, United States",28.0,-82.27
76229,Savage,MD,"Savage, MD","Savage, Howard County, Maryland, 20763, United States",39.15,-76.82
76279,Davenport,FL,"Davenport, FL","Davenport, Polk County, Florida, 33836, United States",28.16,-81.6
76425,Perrysburg,NY,"Perrysburg, NY","Town of Perrysburg, Cattaraugus County, New York, United States",42.46,-79.0
76450,Woodland,MI,"Woodland, MI","Woodland, Hennepin County, Minnesota, United States",44.95,-93.51
76556,Hyden,KY,"Hyden, KY","Hyden, Leslie County, Kentucky, United States",37.16,-83.37
76637,La Pine,OR,"La Pine, OR","La Pine, Deschutes County, Oregon, United States",43.67,-121.5
76707,Pharr,TX,"Pharr, TX","Pharr, Hidalgo County, Texas, 78577, United States",26.19,-98.18
76721,Coolidge,GA,"Coolidge, GA","Coolidge, Thomas County, Georgia, United States",31.01,-83.87
76784,Greenville,FL,"Greenville, FL","Greenville, Madison County, Florida, 32331, United States",30.47,-83.63
76861,Highgate Center,VT,"Highgate Center, VT","Highgate Center, Highgate, Franklin County, Vermont, 05459, United States",44.94,-73.04
76954,Boerne,TX,"Boerne, TX","Boerne, Kendall County, Texas, 78006, United States",29.79,-98.73
77520,Iola,TX,"Iola, TX","Iola, Grimes County, Texas, United States",30.77,-96.08
77673,Guild,TN,"Guild, TN","Guild, 1346, 4th Street Southeast, Capitol Waterfront Neighborhood, Washington, District of Columbia, 20003, United States",38.87,-77.0
77725,Rowlett,TX,"Rowlett, TX","Rowlett, Dallas County, Texas, United States",32.9,-96.56
77927,Belvidere Center,VT,"Belvidere Center, VT","Belvidere Center, Belvidere, Lamoille County, Vermont, 05442, United States",44.75,-72.69
78413,Fairfield,MT,"Fairfield, MT","Fairfield, Teton County, Montana, 59436, United States",47.61,-111.98
79125,Huntingdon Valley,PA,"Huntingdon Valley, PA","Huntingdon Valley, Lower Moreland Township, Montgomery County, Pennsylvania, 19006, United States",40.12,-75.06
79479,China Spring,TX,"China Spring, TX","China Spring Road, Erath, Waco, McLennan County, Texas, 76633, United States",31.63,-97.27
79696,Reston,VA,"Reston, VA","Reston, Fairfax County, Virginia, United States",38.95,-77.35
80112,Mulliken,MI,"Mulliken, MI","Mulliken, Roxand Township, Eaton County, Michigan, United States",42.76,-84.9
81147,Elmira,CA,"Elmira, CA","Elmira, Rural Municipality of Eastern Kings, Kings County, Prince Edward Island, C0A 1K0, Canada",46.44,-62.06
81461,Spicewood,TX,"Spicewood, TX","Spicewood, Burnet County, Texas, United States",30.48,-98.16
81799,Busy,KY,"Busy, KY","Busy, Perry County, Kentucky, 41723, United States",37.28,-83.29
82611,Homer,MI,"Homer, MI","Homer, Kenai Peninsula, Alaska, United States",59.64,-151.54
82757,Jamestown,CO,"Jamestown, CO","Jamestown, James City County, Virginia, 23081, United States",37.21,-76.77
83049,Williamsport,OH,"Williamsport, OH","Williamsport, Pickaway County, Ohio, United States",39.59,-83.12
83280,Palm City,FL,"Palm City, FL","Palm City, Martin County, Florida, 34990, United States",27.17,-80.28
83382,Sanger,TX,"Sanger, TX","The Trails of Sanger, Sanger, Denton County, 76266, United States",33.38,-97.16
83959,Bulan,KY,"Bulan, KY","Bulan, Perry County, Kentucky, 41722, United States",37.3,-83.16
84235,Clinton,WA,"Clinton, WA","Clinton County, Iowa, United States",41.91,-90.56
84591,Montgomery,TX,"Montgomery, TX","Montgomery County, Texas, United States",30.3,-95.51
85333,Honaker,VA,"Honaker, VA","Honaker, Russell County, Virginia, 24260, United States",37.02,-81.97
85385,Sammamish,WA,"Sammamish, WA","Sammamish, King County, Washington, United States",47.6,-122.04
85747,Gaithersburg,MD,"Gaithersburg, MD","Gaithersburg, Montgomery County, Maryland, United States",39.14,-77.19
85942,Beaumont,DE,"Beaumont, DE","Beaumont-Hamel, Péronne, Somme, Hauts-de-France, France métropolitaine, 80300, France",50.08,2.66
87673,Powell,OH,"Powell, OH","Powell, Liberty Township, Delaware County, Ohio, United States",40.16,-83.08
87781,Monkton,VT,"Monkton, VT","Monkton, Addison County, Vermont, 05469, United States",44.25,-73.12
88348,New Hudson,MI,"New Hudson, MI","Town of New Hudson, Allegany County, New York, 14714, United States",42.32,-78.25
88637,Lupton City,TN,"Lupton City, TN","Lupton City, Chattanooga, Hamilton County, East Tennessee, Tennessee, 37351, United States",35.11,-85.26
89225,Cambridge,VT,"Cambridge, VT","Cambridge, Lamoille County, Vermont, United States",44.65,-72.88
89284,Watkinsville,GA,"Watkinsville, GA","Watkinsville, Oconee County, Georgia, 30644, United States",33.86,-83.41
89789,Pounding Mill,VA,"Pounding Mill, VA","Pounding Mill, Tazewell County, Virginia, 24637, United States",37.08,-81.71
89792,Lewis Center,OH,"Lewis Center, OH","Lewis Center, Orange Township, Delaware County, Ohio, 43035, United States",40.2,-83.01
89896,Troy,TX,"Troy, TX","Troy, Bell County, Texas, 76579, United States",31.2,-97.3
90059,Odessa,FL,"Odessa, FL","Odessa, Pasco County, Florida, United States",28.18,-82.55
90303,Midlothian,TX,"Midlothian, TX","Midlothian, Ellis County, Texas, 76065, United States",32.46,-96.98
90839,Clifton,CO,"Clifton, CO","Clifton, Passaic County, New Jersey, United States",40.86,-74.16
91031,Westerville,OH,"Westerville, OH","Westerville, Franklin County, Ohio, 43081, United States",40.13,-82.93
91717,Nora,VA,"Nora, VA","Nora, Banihal, Ramban district, Jammu and Kashmir, India",33.35,75.27
92127,Freeland,MI,"Freeland, MI","Freeland, Tittabawassee Township, Saginaw County, Michigan, 48623, United States",43.53,-84.12
92609,Leicester,NC,"Leicester, NC","Leicester, Buncombe County, North Carolina, 28748, United States",35.66,-82.7
93222,Meservey,IA,"Meservey, IA","Meservey, Cerro Gordo County, Iowa, United States",42.91,-93.48
93537,Drift,KY,"Drift, KY","Drift, Floyd County, Kentucky, 41651, United States",37.48,-82.75
94050,Black Diamond,WA,"Black Diamond, WA","Black Diamond, King County, Washington, 98010, United States",47.31,-122.0
94314,Cornelius,NC,"Cornelius, NC","Cornelius, Mecklenburg County, North Carolina, United States",35.48,-80.86
97360,Okahumpka,FL,"Okahumpka, FL","Okahumpka, Lake County, Florida, United States",28.75,-81.9
97899,Granville,OH,"Granville, OH","Granville, Granville Township, Licking County, Ohio, 43023, United States",40.07,-82.52
98061,Highland,MD,"Highland, MD","Highland, Howard County, Maryland, 20777, United States",39.18,-76.96
98421,Arden,NC,"Arden, NC","Arden, Asheville, Buncombe County, North Carolina, 28707, United States",35.47,-82.52
98685,Swords Creek,VA,"Swords Creek, VA","Swords Creek, Russell County, Virginia, 24649, United States",37.04,-81.92
99743,Alviso,CA,"Alviso, CA","Alviso, San Jose, Santa Clara County, California, 95002, United States",37.43,-121.98
100637,Hallsville,TX,"Hallsville, TX","Hallsville City Park, Hallsville, Harrison County, 75650, United States",32.51,-94.57
100690,Cherry Valley,MA,"Cherry Valley, MA","Cherry Valley, Rockford Township, Winnebago County, Illinois, United States",42.24,-88.96
101010,Chestnut Hill,MA,"Chestnut Hill, MA","Chestnut Hill, Newton, Middlesex County, Massachusetts, 02138, United States",42.33,-71.17
101516,Lizella,GA,"Lizella, GA","Lizella, Macon, Bibb County, Georgia, 31052, United States",32.81,-83.82
101781,Flint,TX,"Flint, TX","Flint, Smith County, Texas, United States",32.2,-95.35
101868,Dante,VA,"Dante, VA","Dante, Russell County, Virginia, 24237, United States",36.98,-82.3
101917,Yarmouth Port,MA,"Yarmouth Port, MA","Yarmouth Port, Yarmouth, Barnstable County, Massachusetts, 02675, United States",41.7,-70.25
103160,Jeff,KY,"Jeff, KY","Jeff, Perry County, Kentucky, 41751, United States",37.21,-83.14
103291,Eagle Lake,FL,"Eagle Lake, FL","Eagle Lake, Polk County, Florida, 33839, United States",27.98,-81.76
103586,Palmyra,TN,"Palmyra, TN","Palmyra, Montgomery County, Middle Tennessee, Tennessee, 37142, United States",36.44,-87.49
103620,Pleasanton,TX,"Pleasanton, TX","Pleasanton, Atascosa County, 78064, United States",28.97,-98.48
106258,Fultonham,OH,"Fultonham, OH","Fultonham, Muskingum County, Ohio, 43738, United States",39.86,-82.14
106697,Schertz,TX,"Schertz, TX","Schertz, Guadalupe County, Texas, 78154, United States",29.56,-98.27
108097,Silver Creek,NY,"Silver Creek, NY","Village of Silver Creek, Town of Hanover, Chautauqua County, New York, 14136, United States",42.54,-79.17
108466,Moapa,NV,"Moapa, NV","Moapa Town, Clark County, Nevada, United States",36.68,-114.62
108624,Lorena,TX,"Lorena, TX","Lorena, McLennan County, Texas, United States",31.39,-97.22
108629,Mead,WA,"Mead, WA","Mead, Spokane County, Washington, 99021, United States",47.77,-117.35
109379,Santa Ana,TN,"Santa Ana, TN","Santa Ana, Z. 7 SCP, Santa Catarina Pinula, Departamento de Guatemala, 01052, Guatemala",14.54,-90.44
109811,Breezy Point,NY,"Breezy Point, NY","Breezy Point, Queens County, City of New York, New York, United States",40.56,-73.93
111503,Browns Summit,NC,"Browns Summit, NC","Browns Summit, Guilford County, North Carolina, 27214, United States",36.21,-79.71
112762,Clarksville,MI,"Clarksville, MI","Clarksville, Montgomery County, Middle Tennessee, Tennessee, United States",36.53,-87.36
112943,Fort Lauderdale,Fl,"Fort Lauderdale, Fl","Fort Lauderdale, Broward County, Florida, United States",26.12,-80.14
115632,Rye,CO,"Rye, CO","City of Rye, Westchester County, New York, United States",40.98,-73.68
117501,Castle Hayne,NC,"Castle Hayne, NC","Castle Hayne, New Hanover County, North Carolina, United States",34.35,-77.91
120563,Rural Hall,NC,"Rural Hall, NC","Rural Hall, Forsyth County, North Carolina, 27045, United States",36.24,-80.29
120697,Olalla,WA,"Olalla, WA","Olalla, Kitsap County, Washington, 98359, United States",47.43,-122.54
