,major_city,state,city_state,geocode,city_latitude,city_longitude
3344,Odessa,TX,"Odessa, TX","Odessa, Ector County, Texas, United States",31.85,-102.37
3363,Pasadena,TX,"Pasadena, TX","Pasadena, Harris County, Texas, United States",29.69,-95.21
3373,Lake Odessa,MI,"Lake Odessa, MI","Lake Odessa, Odessa Township, Ionia County, Michigan, 48849, United States",42.78,-85.14
3387,Allen,TX,"Allen, TX","Allen, Collin County, Texas, United States",33.1,-96.67
3392,Humble,TX,"Humble, TX","Humble, Harris County, United States",30.0,-95.26
3407,Thousand Oaks,CA,"Thousand Oaks, CA","Thousand Oaks, Ventura County, California, United States",34.17,-118.84
3422,Fort Collins,CO,"Fort Collins, CO","Fort Collins, Larimer County, Colorado, United States",40.55,-105.07
3435,Provo,UT,"Provo, UT","Provo, Utah County, Utah, United States",40.23,-111.66
3471,Lorain,OH,"Lorain, OH","Lorain, Lorain County, Ohio, United States",41.47,-82.18
3496,Rosedale,NY,"Rosedale, NY","Rosedale, Queens County, City of New York, New York, 11422, United States",40.66,-73.74
3501,Mayville,NY,"Mayville, NY","Village of Mayville, Town of Chautauqua, Chautauqua County, New York, United States",42.25,-79.5
3508,Kansas City,MO,"Kansas City, MO","Kansas City, Jackson County, Missouri, United States",39.1,-94.58
3518,Kennewick,WA,"Kennewick, WA","Kennewick, Benton County, Washington, United States",46.21,-119.12
3524,Pueblo,CO,"Pueblo, CO","Pueblo, Pueblo County, Colorado, United States",38.25,-104.61
3537,Bainbridge Island,WA,"Bainbridge Island, WA","Bainbridge Island, Kitsap County, Washington, 98110, United States",47.65,-122.55
3546,Columbus,OH,"Columbus, OH","Columbus, Franklin County, Ohio, United States",39.96,-83.0
3551,Falconer,NY,"Falconer, NY","Village of Falconer, Town of Ellicott, Chautauqua County, New York, United States",42.12,-79.2
3562,Grand Junction,CO,"Grand Junction, CO","Grand Junction, Mesa County, Colorado, United States",39.06,-108.55
3569,Shelburne,VT,"Shelburne, VT","Shelburne, Chittenden County, Vermont, 05482, United States",44.38,-73.23
3612,Fairfield,PA,"Fairfield, PA","Fairfield, Jefferson County, Alabama, United States",33.49,-86.91
3649,Naperville,IL,"Naperville, IL","Naperville, DuPage County, Illinois, United States",41.77,-88.15
3662,Indian Orchard,MA,"Indian Orchard, MA","Indian Orchard, Springfield, Hampden County, Massachusetts, 01151, United States",42.16,-72.5
3674,Middleville,NY,"Middleville, NY","Village of Middleville, Town of Fairfield, Herkimer County, New York, United States",43.14,-74.97
3685,Jacksonville,NC,"Jacksonville, NC","Jacksonville, Onslow County, North Carolina, United States",34.75,-77.42
3729,Stockton,CA,"Stockton, CA","Stockton, San Joaquin County, California, United States",37.96,-121.29
3731,Glendale,UT,"Glendale, UT","Glendale, Salt Lake City, Salt Lake County, Utah, 84104, United States",40.74,-111.93
3740,Nashville,NC,"Nashville, NC","Nashville, Nash County, North Carolina, United States",35.97,-77.97
3800,Ann Arbor,MI,"Ann Arbor, MI","Ann Arbor, Washtenaw County, Michigan, United States",42.27,-83.73
3885,Sherman Oaks,CA,"Sherman Oaks, CA","Sherman Oaks, Los Angeles, Los Angeles County, California, 91403, United States",34.15,-118.45
3901,Modesto,CA,"Modesto, CA","Modesto, Stanislaus County, California, United States",37.64,-121.0
3934,Middle Village,NY,"Middle Village, NY","Middle Village, Queens County, City of New York, New York, 11379, United States",40.72,-73.88
4022,Dallas,NC,"Dallas, NC","Dallas, Gaston County, North Carolina, United States",35.32,-81.18
4041,Antelope,CA,"Antelope, CA","Antelope, Sacramento County, California, 95842, United States",38.71,-121.33
4110,San Bernardino,CA,"San Bernardino, CA","San Bernardino County, California, United States",34.83,-116.08
4115,Celina,TX,"Celina, TX","Celina, Collin County, Texas, 75009, United States",33.32,-96.79
4131,Saginaw,MI,"Saginaw, MI","City of Saginaw, Saginaw County, Michigan, United States",43.42,-83.95
4167,Katy,TX,"Katy, TX","Katy, Fort Bend County, Texas, United States",29.79,-95.82
4230,Hillsboro,OR,"Hillsboro, OR","Hillsboro, Washington County, Oregon, United States",45.52,-122.99
4239,Goodlettsville,TN,"Goodlettsville, TN","Goodlettsville, Sumner County, Middle Tennessee, Tennessee, 37072, United States",36.33,-86.71
4254,Fremont,CA,"Fremont, CA","Fremont, Alameda County, California, United States",37.55,-121.99
4258,Camby,IN,"Camby, IN","Camby, Indianapolis, Marion County, Indiana, 46113, United States",39.66,-86.31
4290,Littcarr,KY,"Littcarr, KY","Littcarr, Knott County, Kentucky, 41847, United States",37.24,-82.95
4321,Laveen,AZ,"Laveen, AZ","Laveen, Phoenix, Maricopa County, Arizona, 85399, United States",33.36,-112.15
4331,Redford,MI,"Redford, MI","Redford, Redford Charter Township, Wayne County, Michigan, 48239, United States",42.38,-83.3
4340,El Monte,CA,"El Monte, CA","El Monte, Los Angeles County, California, 91731, United States",34.08,-118.04
4348,North Port,FL,"North Port, FL","North Port, Sarasota County, Florida, United States",27.04,-82.24
4384,Beulah,CO,"Beulah, CO","Beulah, Mercer County, North Dakota, United States",47.26,-101.78
4515,Alexandria,VA,"Alexandria, VA","Alexandria, Virginia, United States",38.81,-77.05
4533,Peoria,IL,"Peoria, IL","Peoria, Peoria County, Illinois, United States",40.69,-89.59
4544,Clovis,CA,"Clovis, CA","Clovis, Fresno County, California, United States",36.83,-119.7
4568,Oakland,ME,"Oakland, ME","Oakland, Kennebec County, Maine, 04963, United States",44.54,-69.72
4590,Mission Hills,CA,"Mission Hills, CA","Mission Hills, Santa Barbara County, California, United States",34.69,-120.44
4594,Issaquah,WA,"Issaquah, WA","Issaquah, King County, Washington, United States",47.53,-122.04
4610,Poughkeepsie,NY,"Poughkeepsie, NY","City of Poughkeepsie, Dutchess County, New York, 12601, United States",41.71,-73.93
4636,American Canyon,CA,"American Canyon, CA","American Canyon, Napa County, California, United States",38.22,-122.23
4654,Rock Spring,GA,"Rock Spring, GA","Rock Spring, Walker County, Georgia, 30739, United States",34.82,-85.24
4675,Sheldon,VT,"Sheldon, VT","Sheldon, Franklin County, Vermont, United States",44.88,-72.94
4679,Gowanda,NY,"Gowanda, NY","Village of Gowanda / Jogowöde', Town of Persia, Cattaraugus County, New York, 14070, United States",42.46,-78.94
4692,Charlotte,MI,"Charlotte, MI","Charlotte, Mecklenburg County, North Carolina, United States",35.23,-80.84
4693,Granada Hills,CA,"Granada Hills, CA","Granada Hills, Granada Hills South Neighborhood Council District, Los Angeles, Los Angeles County, California, 91325, United States",34.27,-118.52
4694,Emeryville,CA,"Emeryville, CA","Emeryville, Alameda County, California, 94608, United States",37.83,-122.29
4696,South Pittsburg,TN,"South Pittsburg, TN","South Pittsburg, Marion County, East Tennessee, Tennessee, 37380, United States",35.01,-85.71
4718,Costa Mesa,CA,"Costa Mesa, CA","Costa Mesa, Orange County, California, United States",33.66,-117.9
4724,Beltsville,MD,"Beltsville, MD","Beltsville, Prince George's County, Maryland, 20705, United States",39.04,-76.93
4731,Lanham,MD,"Lanham, MD","Lanham, Glenn Dale, Prince George's County, Maryland, 20706, United States",38.97,-76.84
4753,Springfield Gardens,NY,"Springfield Gardens, NY","Springfield Gardens, Queens County, City of New York, New York, 11413, United States",40.68,-73.75
4770,South Bend,IN,"South Bend, IN","South Bend, Saint Joseph County, Indiana, United States",41.68,-86.25
4775,Pleasantville,OH,"Pleasantville, OH","Pleasantville, Fairfield County, Ohio, United States",39.81,-82.52
4802,Ionia,MI,"Ionia, MI","Ionia County, Michigan, United States",42.95,-85.07
4837,Midland,GA,"Midland, GA","Midland, Columbus, Muscogee County, Georgia, 31820, United States",32.57,-84.83
4846,Pacific Palisades,CA,"Pacific Palisades, CA","Pacific Palisades, Los Angeles, Los Angeles County, California, 90402, United States",34.05,-118.53
4880,Battle Creek,MI,"Battle Creek, MI","Battle Creek, Calhoun County, Michigan, 49015, United States",42.32,-85.18
4894,Rockaway Park,NY,"Rockaway Park, NY","Rockaway Park, Queens County, City of New York, New York, United States",40.58,-73.84
4925,Reynoldsburg,OH,"Reynoldsburg, OH","Reynoldsburg, Truro Township, Franklin County, Ohio, 43068, United States",39.95,-82.81
4950,Rochester,NY,"Rochester, NY","City of Rochester, Monroe County, New York, United States",43.16,-77.62
4954,Studio City,CA,"Studio City, CA","Studio City, Los Angeles, Los Angeles County, California, 91604, United States",34.15,-118.4
4978,Whites Creek,TN,"Whites Creek, TN","Whites Creek, Nashville-Davidson, Davidson County, Middle Tennessee, Tennessee, United States",36.21,-86.83
5002,Texas City,TX,"Texas City, TX","Texas City, Galveston County, United States",29.4,-94.92
5021,Tyrone,NY,"Tyrone, NY","Town of Tyrone, Schuyler County, New York, 14887, United States",42.41,-77.06
5034,Joliet,IL,"Joliet, IL","Joliet, Will County, Illinois, United States",41.53,-88.08
5035,El Mirage,AZ,"El Mirage, AZ","El Mirage, Maricopa County, Arizona, 85335, United States",33.61,-112.32
5062,Carroll,OH,"Carroll, OH","Carroll County, Ohio, United States",40.53,-81.09
5150,Garner,IA,"Garner, IA","Garner, Hancock County, Iowa, United States",43.1,-93.6
5196,Avondale,AZ,"Avondale, AZ","Avondale, Maricopa County, Arizona, United States",33.44,-112.35
5276,Arverne,NY,"Arverne, NY","Arverne, Queens County, City of New York, New York, 11692, United States",40.59,-73.79
5335,Ozone Park,NY,"Ozone Park, NY","Ozone Park, Queens County, City of New York, New York, 11417, United States",40.68,-73.84
5340,Pinellas Park,FL,"Pinellas Park, FL","Pinellas Park, Pinellas County, Florida, United States",27.84,-82.7
5342,Akron,OH,"Akron, OH","Akron, Summit County, Ohio, United States",41.08,-81.52
5368,Port Orchard,WA,"Port Orchard, WA","Port Orchard, Kitsap County, Washington, United States",47.53,-122.64
5391,Adams,TN,"Adams, TN","Adams County, Washington, United States",46.97,-118.59
5422,Frisco,TX,"Frisco, TX","Frisco, Collin County, Texas, United States",33.15,-96.82
5438,Thornton,CO,"Thornton, CO","Thornton, Adams County, Colorado, United States",39.87,-104.99
5443,Potomac,MD,"Potomac, MD","Potomac, Montgomery County, Maryland, 20854, United States",39.02,-77.2
5480,Saint Albans,VT,"Saint Albans, VT","Saint Albans, 40, Federal Street, St. Albans, Franklin County, Vermont, 05478, United States",44.81,-73.09
5496,Augusta,GA,"Augusta, GA","Augusta, Richmond County, Georgia, United States",33.47,-81.97
5551,Morrison,CO,"Morrison, CO","Morrison, Grundy County, Iowa, 50657, United States",42.34,-92.67
5679,Simi Valley,CA,"Simi Valley, CA","Simi Valley, Ventura County, California, United States",34.27,-118.75
5719,Dorchester Center,MA,"Dorchester Center, MA","Dorchester Center, Dorchester, Boston, Suffolk County, Massachusetts, 02124, United States",42.29,-71.07
5772,Fairfax,VT,"Fairfax, VT","Fairfax, Franklin County, Vermont, 05454, United States",44.67,-73.01
5781,South Burlington,VT,"South Burlington, VT","South Burlington, Chittenden County, Vermont, United States",44.47,-73.17
5782,Aledo,TX,"Aledo, TX","Aledo, Parker County, Texas, United States",32.7,-97.6
5803,Dewittville,NY,"Dewittville, NY","Dewittville, Town of Chautauqua, Chautauqua County, New York, 14728, United States",42.24,-79.45
5825,Santa Cruz,CA,"Santa Cruz, CA","Santa Cruz County, California, United States",37.05,-121.99
5866,Erie,PA,"Erie, PA","Erie, Erie County, Pennsylvania, United States",42.13,-80.09
5910,Ridgefield,WA,"Ridgefield, WA","Ridgefield, Clark County, Washington, United States",45.82,-122.74
5933,Collins,NY,"Collins, NY","Town of Collins, Erie County, New York, United States",42.5,-78.92
5982,Rancho Santa Fe,CA,"Rancho Santa Fe, CA","Rancho Santa Fe, San Diego County, California, 92067, United States",33.02,-117.2
5989,Salinas,CA,"Salinas, CA","Salinas, Monterey County, California, United States",36.67,-121.66
6011,Harrisburg,PA,"Harrisburg, PA","Harrisburg, Dauphin County, Pennsylvania, United States",40.27,-76.89
6020,Woodinville,WA,"Woodinville, WA","Woodinville, King County, Washington, United States",47.75,-122.16
6035,Vansant,VA,"Vansant, VA","Vansant, Buchanan County, Virginia, 24656, United States",37.23,-82.11
6054,Westminster,CA,"Westminster, CA","Westminster, Orange County, California, United States",33.76,-117.99
6057,Salem,OR,"Salem, OR","Salem, Marion County, Oregon, United States",44.94,-123.03
6143,Bonney Lake,WA,"Bonney Lake, WA","Bonney Lake, Pierce County, Washington, United States",47.19,-122.17
6163,Fairfield,ME,"Fairfield, ME","Fairfield, Somerset County, Maine, United States",44.59,-69.6
6181,Campbell,OH,"Campbell, OH","Campbell, Mahoning County, Ohio, 44405, United States",41.08,-80.59
6247,Hayward,CA,"Hayward, CA","Hayward, Alameda County, California, United States",37.67,-122.08
6267,Dayton,OH,"Dayton, OH","Dayton, Montgomery County, Ohio, United States",39.76,-84.19
6269,Stowe,VT,"Stowe, VT","Stowe, Lamoille County, Vermont, United States",44.46,-72.69
6287,Fredonia,NY,"Fredonia, NY","Village of Fredonia, Town of Pomfret, Chautauqua County, New York, 14063, United States",42.44,-79.33
6294,New Hyde Park,NY,"New Hyde Park, NY","Village of New Hyde Park, Town of North Hempstead, Nassau County, New York, United States",40.74,-73.69
6312,Baltimore,OH,"Baltimore, OH","Baltimore, Fairfield County, Ohio, United States",39.85,-82.6
6324,Nashville,MI,"Nashville, MI","Nashville-Davidson, Davidson County, Middle Tennessee, Tennessee, United States",36.16,-86.77
6328,Vergennes,VT,"Vergennes, VT","Vergennes, Addison County, Vermont, United States",44.17,-73.25
6332,Nolensville,TN,"Nolensville, TN","Nolensville, Williamson County, Middle Tennessee, Tennessee, 37135, United States",35.95,-86.67
6346,Dunlap,IL,"Dunlap, IL","Dunlap, Peoria County, Illinois, United States",40.86,-89.68
6364,Saint Augustine,FL,"Saint Augustine, FL","Saint Augustine, Saint Johns County, Florida, 32084, United States",29.89,-81.31
6390,Martinez,CA,"Martinez, CA","Martinez, Contra Costa County, California, 94553, United States",38.01,-122.13
6412,Pflugerville,TX,"Pflugerville, TX","Pflugerville, Travis County, Texas, United States",30.44,-97.62
6596,Missouri City,TX,"Missouri City, TX","TX 6, Missouri City, Fort Bend County, 77459, United States",29.53,-95.51
6622,Clear Lake,IA,"Clear Lake, IA","Clear Lake, Cerro Gordo County, Iowa, 50428, United States",43.14,-93.38
6628,Hephzibah,GA,"Hephzibah, GA","Hephzibah, Richmond County, Georgia, United States",33.31,-82.1
6636,Tolleson,AZ,"Tolleson, AZ","Tolleson, Maricopa County, Arizona, United States",33.45,-112.26
6670,Orange Park,FL,"Orange Park, FL","Orange Park, Clay County, Florida, United States",30.17,-81.7
6689,Oak Ridge,NC,"Oak Ridge, NC","Oak Ridge, Guilford County, North Carolina, 27310, United States",36.17,-79.99
6702,Gig Harbor,WA,"Gig Harbor, WA","Gig Harbor, Pierce County, Washington, 98335, United States",47.33,-122.59
6764,Woodside,NY,"Woodside, NY","Woodside, Queens County, City of New York, New York, 11377, United States",40.75,-73.91
6779,Culver City,CA,"Culver City, CA","Culver City, Los Angeles County, California, United States",34.02,-118.4
6781,Mission Viejo,CA,"Mission Viejo, CA","Mission Viejo, Orange County, California, United States",33.6,-117.66
6784,Apex,NC,"Apex, NC","Apex, Wake County, North Carolina, 27502, United States",35.73,-78.85
6845,North Hero,VT,"North Hero, VT","North Hero, Grand Isle County, Vermont, 05474, United States",44.82,-73.29
6865,Alburgh,VT,"Alburgh, VT","Alburgh, Grand Isle County, Vermont, 05440, United States",44.98,-73.3
6887,Franklin,VT,"Franklin, VT","Franklin, Franklin County, Vermont, United States",44.98,-72.92
6903,Gilroy,CA,"Gilroy, CA","Gilroy, Santa Clara County, California, 95020, United States",37.01,-121.56
7038,Orange,CA,"Orange, CA","Orange County, California, United States",33.75,-117.87
7058,Kingston Springs,TN,"Kingston Springs, TN","Kingston Springs, Cheatham County, Middle Tennessee, Tennessee, 37082, United States",36.1,-87.12
7076,Stedman,NC,"Stedman, NC","Stedman, Cumberland County, North Carolina, United States",35.01,-78.69
7082,Thomasville,GA,"Thomasville, GA","Thomasville, Thomas County, Georgia, 31792, United States",30.84,-83.98
7090,Palo Alto,CA,"Palo Alto, CA","Palo Alto, Santa Clara County, California, United States",37.44,-122.16
7128,Heath,OH,"Heath, OH","Heath, Licking County, Ohio, United States",40.02,-82.44
7131,Jericho,VT,"Jericho, VT","Jericho, Chittenden County, Vermont, 05465, United States",44.51,-73.0
7148,Kenmore,WA,"Kenmore, WA","Kenmore, King County, Washington, 98028, United States",47.76,-122.25
7167,Champaign,IL,"Champaign, IL","Champaign, Champaign County, Illinois, United States",40.12,-88.24
7215,Salem,OH,"Salem, OH","Salem, Columbiana County, Ohio, United States",40.9,-80.86
7264,Archer,FL,"Archer, FL","Archer, Alachua County, Florida, 32618, United States",29.53,-82.52
7268,Dell City,TX,"Dell City, TX","Dell City, Hudspeth County, Texas, United States",31.94,-105.2
7280,Visalia,CA,"Visalia, CA","Visalia, Tulare County, California, United States",36.33,-119.29
7292,Jamestown,NY,"Jamestown, NY","Jamestown, Chautauqua County, New York, United States",42.1,-79.24
7376,Richmond,CA,"Richmond, CA","Richmond, Contra Costa County, California, United States",37.94,-122.35
7436,Von Ormy,TX,"Von Ormy, TX","Pilot - Von Ormy, Von Ormy, Bexar County, 78073, United States",29.28,-98.67
7449,Mount Juliet,TN,"Mount Juliet, TN","Mount Juliet, Wilson County, Middle Tennessee, Tennessee, United States",36.2,-86.52
7450,Annandale,VA,"Annandale, VA","Annandale, Fairfax County, Virginia, United States",38.84,-77.21
7467,Turlock,CA,"Turlock, CA","Turlock, Stanislaus County, California, United States",37.49,-120.85
7476,La Crescenta,CA,"La Crescenta, CA","La Crescenta, Los Angeles County, California, 91214, United States",34.23,-118.24
7531,Chico,CA,"Chico, CA","Chico, Butte County, California, United States",39.73,-121.84
7627,Mc Lean,VA,"Mc Lean, VA","Mc Lean Station Bus Bay F, Dolley Madison Boulevard, Tysons, Fairfax County, Virginia, 22043, United States",38.93,-77.21
7667,Flushing,MI,"Flushing, MI","Flushing, Genesee County, Michigan, 48433, United States",43.06,-83.85
7692,Elkhart,IN,"Elkhart, IN","Elkhart County, Indiana, United States",41.6,-85.86
7702,Citra,FL,"Citra, FL","Citra, Marion County, Florida, 32113, United States",29.41,-82.11
7711,Falls Church,VA,"Falls Church, VA","Falls Church, Virginia, 22046, United States",38.88,-77.17
7747,Canoga Park,CA,"Canoga Park, CA","Canoga Park, Los Angeles, Los Angeles County, California, 91303, United States",34.2,-118.6
7757,Winterville,NC,"Winterville, NC","Winterville, Pitt County, North Carolina, 28590, United States",35.53,-77.4
7781,Brookpark,OH,"Brookpark, OH","Brookpark, 18010, Brookpark Road, Riverside, Cleveland, Cuyahoga County, Ohio, 44126, United States",41.42,-81.82
7813,Graham,WA,"Graham, WA","Graham, Pierce County, Washington, 09339, United States",47.04,-122.28
7886,Maple Heights,OH,"Maple Heights, OH","Maple Heights, Cuyahoga County, Ohio, 44137, United States",41.42,-81.57
8024,Nashville,IN,"Nashville, IN","Nashville, Brown County, Indiana, United States",39.21,-86.25
8028,Verdi,NV,"Verdi, NV","Verdi-Mogul, Washoe County, Nevada, 89515, United States",39.52,-119.99
8075,Sun City,AZ,"Sun City, AZ","Sun City, Peoria, Maricopa County, Arizona, 85351, United States",33.62,-112.28
8155,Hahira,GA,"Hahira, GA","Hahira, Lowndes County, Georgia, United States",30.99,-83.37
8210,San Pedro,CA,"San Pedro, CA","San Pedro, Los Angeles, Los Angeles County, California, 90731, United States",33.74,-118.29
8270,Georgetown,TX,"Georgetown, TX","Georgetown, Williamson County, Texas, United States",30.63,-97.68
8293,Ecorse,MI,"Ecorse, MI","Ecorse, Wayne County, Michigan, 48229, United States",42.24,-83.15
8315,Spanaway,WA,"Spanaway, WA","Spanaway, Pierce County, Washington, United States",47.1,-122.42
8323,Sugar Grove,OH,"Sugar Grove, OH","Sugar Grove, Fairfield County, Ohio, United States",39.63,-82.55
8326,Cedar Hill,TX,"Cedar Hill, TX","Cedar Hill, Dallas County, Texas, 75104, United States",32.59,-96.96
8385,Dupont,WA,"Dupont, WA","DuPont, Pierce County, Washington, 98327, United States",47.1,-122.64
8526,Herkimer,NY,"Herkimer, NY","Herkimer County, New York, United States",43.49,-74.95
8543,Bryans Road,MD,"Bryans Road, MD","Bryans Road, Charles County, Maryland, 20616, United States",38.63,-77.08
8575,Gresham,OR,"Gresham, OR","Gresham, Multnomah County, Oregon, United States",45.5,-122.43
8578,Goodell,IA,"Goodell, IA","Goodell, Hancock County, Iowa, United States",42.92,-93.61
8595,Roxbury,MA,"Roxbury, MA","Roxbury, Oxford County, Maine, 04275, United States",44.67,-70.59
8696,Playa Vista,CA,"Playa Vista, CA","Playa Vista, Los Angeles, Los Angeles County, California, 90096, United States",33.98,-118.42
8774,Lowell,MA,"Lowell, MA","Lowell, Middlesex County, Massachusetts, United States",42.64,-71.31
8807,Santee,CA,"Santee, CA","Santee, San Diego County, California, 92071, United States",32.84,-116.97
8884,Far Rockaway,NY,"Far Rockaway, NY","Far Rockaway, Queens County, City of New York, New York, 11691, United States",40.61,-73.76
8898,Merced,CA,"Merced, CA","Merced County, California, United States",37.16,-120.77
9005,Cherry Creek,NY,"Cherry Creek, NY","Town of Cherry Creek, Chautauqua County, New York, 14723, United States",42.29,-79.1
9009,El Centro,CA,"El Centro, CA","El Centro, Imperial County, California, 92243, United States",32.79,-115.56
9056,Rossville,GA,"Rossville, GA","Rossville, Walker County, Georgia, United States",34.98,-85.29
9085,Corona,CA,"Corona, CA","Corona, Riverside County, California, United States",33.88,-117.57
9086,New Bedford,MA,"New Bedford, MA","New Bedford, Bristol County, Massachusetts, United States",41.64,-70.93
9120,Round Lake,IL,"Round Lake, IL","Round Lake, Lake County, Illinois, United States",42.35,-88.09
9136,Germantown,MD,"Germantown, MD","Germantown, Montgomery County, Maryland, United States",39.17,-77.27
9163,Elmhurst,NY,"Elmhurst, NY","Elmhurst, Queens County, City of New York, New York, 11373, United States",40.74,-73.88
9215,East Fultonham,OH,"East Fultonham, OH","East Fultonham, Muskingum County, Ohio, 43735, United States",39.85,-82.12
9227,Snohomish,WA,"Snohomish, WA","Snohomish County, Washington, United States",48.01,-121.73
9294,Hope Mills,NC,"Hope Mills, NC","Hope Mills, Cumberland County, North Carolina, United States",34.97,-78.95
9409,Hutto,TX,"Hutto, TX","Hutto, Williamson County, Texas, 78634, United States",30.54,-97.55
9486,Cooleemee,NC,"Cooleemee, NC","Cooleemee, Davie County, North Carolina, 27014, United States",35.81,-80.56
9539,Richlands,VA,"Richlands, VA","Richlands, Tazewell County, Virginia, United States",37.09,-81.8
9738,North Highlands,CA,"North Highlands, CA","North Highlands, Sacramento County, California, 95843, United States",38.69,-121.37
9770,Neptune Beach,FL,"Neptune Beach, FL","Neptune Beach, Duval County, Florida, 32266, United States",30.31,-81.4
9896,San Ysidro,CA,"San Ysidro, CA","San Ysidro, San Diego, San Diego County, California, 92173, United States",32.55,-117.04
9956,Wilmington,CA,"Wilmington, CA","Wilmington, Los Angeles, Los Angeles County, California, 90710, United States",33.78,-118.26
9966,Highland Park,MI,"Highland Park, MI","Highland Park, Wayne County, Michigan, 48203, United States",42.41,-83.1
10053,Cleveland,MS,"Cleveland, MS","Cleveland, Bolivar County, Mississippi, 38732, United States",33.74,-90.72
10111,Vashon,WA,"Vashon, WA","Vashon, King County, Washington, 98070, United States",47.42,-122.47
10200,Utica,NY,"Utica, NY","City of Utica, Oneida County, New York, United States",43.1,-75.23
10383,Burlington,VT,"Burlington, VT","Burlington, Chittenden County, Vermont, United States",44.48,-73.21
10410,Lewisville,TX,"Lewisville, TX","Lewisville, Denton County, Texas, United States",33.05,-96.99
10422,Takoma Park,MD,"Takoma Park, MD","Takoma Park, Montgomery County, Maryland, 20912, United States",38.98,-77.01
10457,Garrett,KY,"Garrett, KY","Garrett, Floyd County, Kentucky, 41630, United States",37.48,-82.83
10475,Jasper,TN,"Jasper, TN","Jasper, Marion County, East Tennessee, Tennessee, 37347, United States",35.07,-85.63
10492,Dickson,TN,"Dickson, TN","Dickson County, Middle Tennessee, Tennessee, United States",36.15,-87.35
10502,West Jordan,UT,"West Jordan, UT","West Jordan, Salt Lake County, Utah, United States",40.61,-111.94
10541,Portland,MI,"Portland, MI","Portland, Multnomah County, Oregon, United States",45.52,-122.67
10675,Greeley,CO,"Greeley, CO","Greeley, Weld County, Colorado, United States",40.42,-104.71
10676,Mira Loma,CA,"Mira Loma, CA","Mira Loma, Jurupa Valley, Riverside County, California, United States",33.98,-117.52
10841,Westfield,NY,"Westfield, NY","Village of Westfield, Town of Westfield, Chautauqua County, New York, 14787, United States",42.32,-79.58
10849,South Holland,IL,"South Holland, IL","South Holland, Thornton Township, Cook County, Illinois, 60473, United States",41.6,-87.61
10854,Mount Perry,OH,"Mount Perry, OH","Mount Perry, Perry County, Ohio, 43760, United States",39.88,-82.22
10979,Charlestown,MA,"Charlestown, MA","Charlestown, Boston, Suffolk County, Massachusetts, 02129, United States",42.38,-71.06
10982,Daly City,CA,"Daly City, CA","Daly City, San Mateo County, California, 94015, United States",37.69,-122.47
11027,Midway Park,NC,"Midway Park, NC","Midway Park, Jacksonville, Onslow County, North Carolina, 28544, United States",34.73,-77.34
11039,Pomona,CA,"Pomona, CA","Pomona, Los Angeles County, California, United States",34.06,-117.75
11064,Columbia,MO,"Columbia, MO","Columbia, Boone County, Missouri, United States",38.95,-92.33
11135,Brighton,MA,"Brighton, MA","Brighton, East Sussex, England, BN1 1HH, United Kingdom",50.82,-0.14
11231,Harper Woods,MI,"Harper Woods, MI","Harper Woods, Wayne County, Michigan, 48225, United States",42.43,-82.92
