,city_state,geocode,city_latitude,city_longitude,city,state
10996,"JACKSONVILLE, FL","Jacksonville, Duval County, Florida, United States",30.33,-81.66,JACKSONVILLE,FL
11141,"Harper Woods, MI","Harper Woods, Wayne County, Michigan, 48225, United States",42.43,-82.92,Harper Woods,MI
11193,"Brighton, CO","Brighton, Adams County, Colorado, United States",39.98,-104.81,Brighton,CO
11199,"Stallings, NC","Stallings, Union County, North Carolina, 28014, United States",35.11,-80.66,Stallings,NC
11255,"APOPKA, FL","Apopka, Orange County, Florida, United States",28.68,-81.51,APOPKA,FL
11268,"Georgia, VT","Georgia, Franklin County, Vermont, United States",44.73,-73.12,Georgia,VT
11316,"New Haven, VT","New Haven, Addison County, Vermont, 05472, United States",44.12,-73.15,New Haven,VT
11324,"Oxnard, CA","Oxnard, Ventura County, California, United States",34.2,-119.18,Oxnard,CA
11346,"Hemet, CA","Hemet, Riverside County, California, United States",33.75,-116.97,Hemet,CA
11356,"Hinesburg, VT","Hinesburg, Chittenden County, Vermont, 05461, United States",44.33,-73.11,Hinesburg,VT
11408,"Barrington, CA","Barrington, Municipality of the District of Barrington, Shelburne County, Nova Scotia, Canada",43.56,-65.56,Barrington,CA
11427,"Bedford, OH","Bedford, Cuyahoga County, Ohio, 44146, United States",41.39,-81.54,Bedford,OH
11462,"Tarkington Prairie, TX",,,,Tarkington Prairie,TX
11468,"Fairview, TX","Fairview, Austin, Travis County, Texas, United States",30.21,-97.78,Fairview,TX
11533,"Temple Hills, MD","Temple Hills, Prince George's County, Maryland, 20748, United States",38.81,-76.95,Temple Hills,MD
11549,"Naples, FL","Naples, Collier County, Florida, United States",26.14,-81.79,Naples,FL
11595,"Lehigh, FL","Lehigh Acres, Lee County, Florida, United States",26.61,-81.65,Lehigh,FL
11649,"Seatac, WA","SeaTac, King County, Washington, United States",47.44,-122.28,Seatac,WA
11650,"Berkeley, CA","Berkeley, Alameda County, California, United States",37.87,-122.27,Berkeley,CA
11653,"Webster, TX","West Webster Street Park, Fourth Ward, Houston, Harris County, 77019, United States",29.75,-95.38,Webster,TX
11671," , NY","New York, United States",43.16,-75.84, ,NY
11695,"Saltville, VA","Saltville, Smyth County, Virginia, United States",36.88,-81.76,Saltville,VA
11722,"Castlewood, VA","Castlewood, Temple Hill, Russell County, Virginia, United States",36.88,-82.28,Castlewood,VA
11735,"Kingston, WA","Kingston, Kitsap County, Washington, 98346, United States",47.8,-122.5,Kingston,WA
11796,"Carlsbad, CA","Carlsbad, San Diego County, California, United States",33.16,-117.35,Carlsbad,CA
11801,"Arvada, CO","Arvada, Jefferson County, Colorado, United States",39.8,-105.08,Arvada,CO
11812,"Rosedale, NY","Rosedale, Queens County, City of New York, New York, 11422, United States",40.66,-73.74,Rosedale,NY
11843,"Los angeles, CA","Los Angeles, Los Angeles County, California, United States",34.05,-118.24,Los angeles,CA
11896,"Encino, CA","Encino, Los Angeles, Los Angeles County, California, 91436, United States",34.16,-118.5,Encino,CA
11941,"Cambridge, VT","Cambridge, Lamoille County, Vermont, United States",44.65,-72.88,Cambridge,VT
12081,"North Pt, FL","North Port, Sarasota County, Florida, United States",27.04,-82.24,North Pt,FL
12153,"Concord, CA","Concord, Contra Costa County, California, United States",37.98,-122.03,Concord,CA
12159,"Yuba City, CA","Yuba City, Sutter County, California, United States",39.14,-121.62,Yuba City,CA
12169,"Viper, KY","Viper, Perry County, Kentucky, 41774, United States",37.18,-83.15,Viper,KY
12351,"Biltmore Forest, NC","Biltmore Forest, Buncombe County, North Carolina, United States",35.53,-82.53,Biltmore Forest,NC
12395,"Dorchester, MA","Dorchester County, Maryland, United States",38.39,-76.1,Dorchester,MA
12439,"Hallandale, FL","Hallandale Beach, Broward County, Florida, 33009, United States",25.98,-80.15,Hallandale,FL
12496,"Mc Allen, TX",,,,Mc Allen,TX
12566,"Stow, NY","Stow, Town of North Harmony, Chautauqua County, New York, 14785, United States",42.16,-79.4,Stow,NY
12689,"Brier, WA","Brier, Snohomish County, Washington, 98036, United States",47.78,-122.27,Brier,WA
12718,"Lancaster, PA","Lancaster, Lancaster County, Pennsylvania, United States",40.04,-76.31,Lancaster,PA
12722,"Barney, GA","Barney, Brooks County, Georgia, United States",31.01,-83.51,Barney,GA
12727,"Bunnell, FL","Bunnell, Flagler County, Florida, 32110, United States",29.47,-81.26,Bunnell,FL
12751,"Greenbelt, MD","Greenbelt, Spring Manor Drive, Greenbelt, Prince George's County, Maryland, 20770, United States",38.99,-76.88,Greenbelt,MD
12756,"Bladensburg, MD","Bladensburg, Prince George's County, Maryland, 20710, United States",38.94,-76.93,Bladensburg,MD
12761,"Medford, OR","Medford, Jackson County, Oregon, United States",42.33,-122.87,Medford,OR
12826,"Waldorf, MD","Waldorf, Charles County, Maryland, 20601, United States",38.64,-76.91,Waldorf,MD
12908,"Cleveland, OK","Cleveland County, Oklahoma, United States",35.23,-97.31,Cleveland,OK
12971,"Hindman, KY","Hindman, Knott County, Kentucky, United States",37.34,-82.98,Hindman,KY
12983,"Fort Wayne, IN","Fort Wayne, Allen County, Indiana, United States",41.08,-85.14,Fort Wayne,IN
12987,"St. Albans City, VT",,,,St. Albans City,VT
12993,"Newbury Park, CA","Newbury Park, Thousand Oaks, Ventura County, California, 91320, United States",34.18,-118.91,Newbury Park,CA
13003,"Winters, CA","Winters, Yolo County, California, United States",38.52,-121.97,Winters,CA
13011,"Upper Marlboro, MD","Upper Marlboro, Prince George's County, Maryland, United States",38.81,-76.76,Upper Marlboro,MD
13059,"Chamblee, GA","Chamblee, DeKalb County, Georgia, 30341, United States",33.89,-84.3,Chamblee,GA
13060,"River Rouge, MI","River Rouge, Wayne County, Michigan, 48218, United States",42.27,-83.14,River Rouge,MI
13078,"Marstons Mills, MA","Marstons Mills, Barnstable, Barnstable County, Massachusetts, 02648, United States",41.66,-70.42,Marstons Mills,MA
13095,"Redington Shores, FL","Redington Shores, Pinellas County, Florida, United States",27.83,-82.83,Redington Shores,FL
13154,"Belvidere, IL","Belvidere, Belvidere Township, Boone County, Illinois, 61008, United States",42.26,-88.84,Belvidere,IL
13175,"Ashville, NY","Ashville, Town of North Harmony, Chautauqua County, New York, 14710, United States",42.1,-79.38,Ashville,NY
13207,"Algona, WA","Algona, Kossuth County, Iowa, 50511, United States",43.07,-94.23,Algona,WA
13224,"Castle Hills, TX","Castle Hills Northeast, Denton County, Texas, United States",33.07,-96.88,Castle Hills,TX
13260,"Buena Ventura Lakes, FL","Buena Ventura Lakes Wastewater Treatment Facility, Florida's Turnpike, Kissimmee, Osceola County, Florida, 34744, United States",28.32,-81.37,Buena Ventura Lakes,FL
13308,"Los Gatos, CA","Los Gatos, Santa Clara County, California, 95030, United States",37.23,-121.97,Los Gatos,CA
13325,"Brown Deer, WI","Brown Deer, Milwaukee County, Wisconsin, United States",43.17,-87.97,Brown Deer,WI
13339,"Charlotte, ME","Charlotte, Washington County, Maine, United States",45.02,-67.25,Charlotte,ME
13341,"Alta Loma, CA","Alta Loma, Rancho Cucamonga, San Bernardino County, California, 91730, United States",34.12,-117.6,Alta Loma,CA
13386,"Other City Value - Out Of Area, FL",,,,Other City Value - Out Of Area,FL
13416,"Porter Ranch, CA","Porter Ranch, Los Angeles, Los Angeles County, California, 91326, United States",34.28,-118.56,Porter Ranch,CA
13567,"Williamsville, NY","Village of Williamsville, Town of Amherst, Erie County, New York, United States",42.96,-78.74,Williamsville,NY
13654,"Rye, TX","TX 146, Big Thicket Creekmore Village, Rye, Liberty County, 77326, United States",30.47,-94.77,Rye,TX
13738,"Morgan Hill, CA","Morgan Hill, Santa Clara County, California, 95038, United States",37.13,-121.65,Morgan Hill,CA
13825,"Knightdale, NC","Knightdale, Wake County, North Carolina, 27545, United States",35.79,-78.48,Knightdale,NC
13994,"Christiana, TN","Christiana, Rutherford County, Middle Tennessee, Tennessee, 37037, United States",35.71,-86.4,Christiana,TN
14066,"Playa Del Rey, CA","Playa del Rey, Los Angeles, Los Angeles County, California, 90293, United States",33.95,-118.44,Playa Del Rey,CA
14088,"Fircrest, WA","Fircrest, Pierce County, Washington, United States",47.23,-122.51,Fircrest,WA
14089,"Rancho Cucamonga, CA","Rancho Cucamonga, San Bernardino County, California, United States",34.1,-117.58,Rancho Cucamonga,CA
14154,"MIAMI, FL","Miami, Miami-Dade County, Florida, United States",25.77,-80.19,MIAMI,FL
14179,"Timnath, CO","Timnath, Larimer County, Colorado, 80547, United States",40.53,-104.98,Timnath,CO
14349,"Eastover, NC","Eastover, Cumberland County, North Carolina, United States",35.1,-78.79,Eastover,NC
14363,"North Redington Beach, FL","North Redington Beach, Pinellas County, Florida, United States",27.82,-82.82,North Redington Beach,FL
14455,"Murray, UT","Murray, Salt Lake County, Utah, 84107, United States",40.67,-111.89,Murray,UT
14498,"Palmer, TX","Palmer, Ellis County, Texas, United States",32.43,-96.67,Palmer,TX
14513,"Trenton, GA","Trenton, Dade County, Georgia, United States",34.87,-85.51,Trenton,GA
14521,"Biscoe, NC","Biscoe, Montgomery County, North Carolina, United States",35.36,-79.78,Biscoe,NC
14584,"Newburgh Heights, OH","Newburgh Heights, Cuyahoga County, Ohio, United States",41.45,-81.66,Newburgh Heights,OH
14620,"Bay Ridge, NY","Bay Ridge, Brooklyn, Kings County, City of New York, New York, 11209, United States",40.63,-74.02,Bay Ridge,NY
14622,"Panorama City, CA","Panorama City, Panorama City Neighborhood Council District, Los Angeles, Los Angeles County, California, 91402, United States",34.22,-118.45,Panorama City,CA
14653,"Valdosta, GA","Valdosta, Lowndes County, Georgia, United States",30.83,-83.28,Valdosta,GA
14655,"Highland Hills, OH","Highland Hills, Cuyahoga County, Ohio, United States",41.45,-81.52,Highland Hills,OH
14698,"Greenbrier, TN","Greenbrier, Robertson County, Middle Tennessee, Tennessee, 37073, United States",36.43,-86.8,Greenbrier,TN
14843,"Valley Village, CA","Valley Village, Los Angeles, Los Angeles County, California, 91607, United States",34.16,-118.4,Valley Village,CA
14896,"Wildwood, GA","Wildwood, Chicago, Jefferson Township, Cook County, Illinois, United States",42.0,-87.78,Wildwood,GA
14966,"Douglaston, NY","Douglaston, Queens County, City of New York, New York, 11363, United States",40.77,-73.75,Douglaston,NY
15049,"Bartlett, TN","Bartlett, Shelby County, West Tennessee, Tennessee, United States",35.2,-89.87,Bartlett,TN
15107,"Ontario, CA","Ontario, Canada",50.0,-86.0,Ontario,CA
15130,"--, FL","Florida, United States",27.76,-81.46,--,FL
15157,"San Mateo, CA","San Mateo County, California, United States",37.5,-122.33,San Mateo,CA
15204,"College Pt, NY","College Point, Queens County, City of New York, New York, 11356, United States",40.79,-73.85,College Pt,NY
15237,"NORTH REDINGTON BEACH, FL","North Redington Beach, Pinellas County, Florida, United States",27.82,-82.82,NORTH REDINGTON BEACH,FL
15307,"Anderson Island, WA","Anderson Island, Pierce County, Washington, 98303, United States",47.16,-122.71,Anderson Island,WA
15353,"Bowie, MD","Bowie, Prince George's County, Maryland, United States",38.94,-76.73,Bowie,MD
15466,"Delton, MI","Delton, Barry Township, Barry County, Michigan, 49046, United States",42.5,-85.41,Delton,MI
15507,"Scarsdale, NY","Village of Scarsdale, Westchester County, New York, 10583, United States",40.99,-73.8,Scarsdale,NY
15551,"Colchester, VT","Colchester, Chittenden County, Vermont, 05446, United States",44.54,-73.21,Colchester,VT
15571,"Dania, FL","Dania, Northwest 4th Avenue, Dania Beach, Broward County, Florida, 33004, United States",26.05,-80.15,Dania,FL
15691,"Ft Lauderdale, FL","Fort Lauderdale, Broward County, Florida, United States",26.12,-80.14,Ft Lauderdale,FL
15726,"Fairfield, VT","Fairfield, Franklin County, Vermont, 05455, United States",44.8,-72.95,Fairfield,VT
15755,"National Harbor, MD","National Harbor, Potomac Vista, National Harbor, Prince George's County, Maryland, 20745, United States",38.78,-77.01,National Harbor,MD
15892,"Forest City, IA","Forest City, Winnebago County, Iowa, 50436, United States",43.26,-93.64,Forest City,IA
15916,"Brookpark, OH","Brookpark, 18010, Brookpark Road, Riverside, Cleveland, Cuyahoga County, Ohio, 44126, United States",41.42,-81.82,Brookpark,OH
15945,"Santa Clara, CA","Santa Clara County, California, United States",37.23,-121.68,Santa Clara,CA
16081,"Benicia, CA","Benicia, Solano County, California, 94510, United States",38.05,-122.16,Benicia,CA
16120,"South Pasadena, CA","South Pasadena, Los Angeles County, California, 91030, United States",34.11,-118.15,South Pasadena,CA
16171,"Haltom City, TX","Haltom City, Tarrant County, Texas, United States",32.8,-97.27,Haltom City,TX
16191,"Lyons, MI","Lyons, Lyons Township, Cook County, Illinois, United States",41.81,-87.82,Lyons,MI
16313,"Forestville, NY","Forestville, Town of Hanover, Chautauqua County, New York, United States",42.47,-79.18,Forestville,NY
16402,"Elk Grove, CA","Elk Grove, Sacramento County, California, 95624, United States",38.41,-121.37,Elk Grove,CA
16441,"Mckinney, TX","McKinney, Collin County, Texas, United States",33.2,-96.62,Mckinney,TX
16471,"Baldwin, FL","Baldwin, Duval County, Florida, United States",30.3,-81.98,Baldwin,FL
16538,"Brush Prairie, WA","Brush Prairie, Battle Ground, Clark County, Washington, United States",45.73,-122.54,Brush Prairie,WA
16608,"Flintstone, GA","Flintstone, Walker County, Georgia, 30725, United States",34.94,-85.34,Flintstone,GA
16629,"Springfield, MO","Springfield, Greene County, Missouri, United States",37.2,-93.29,Springfield,MO
16641,"Manhattan, NY","Manhattan, New York County, City of New York, New York, United States",40.79,-73.96,Manhattan,NY
16676,"West Hills, CA","West Hills, Los Angeles, Los Angeles County, California, 91307, United States",34.2,-118.65,West Hills,CA
16795,"Bemus Point, NY","Village of Bemus Point, Town of Ellery, Chautauqua County, New York, United States",42.16,-79.39,Bemus Point,NY
16853,"Chautauqua, NY","Chautauqua County, New York, United States",42.29,-79.42,Chautauqua,NY
16897,"Aurora, IL","Aurora, Aurora Township, Kane County, Illinois, United States",41.76,-88.31,Aurora,IL
16913,"Briarwood, NY","Briarwood, Van Wyck Expressway, Kew Gardens, Queens, City of New York, New York, 11415, United States",40.71,-73.82,Briarwood,NY
16947,"La Tuna Canyon, CA",,,,La Tuna Canyon,CA
16958,"Clemmons, NC","Clemmons, Forsyth County, North Carolina, United States",36.02,-80.38,Clemmons,NC
16977,"Cambridge, MA","Cambridge, Middlesex County, Massachusetts, United States",42.38,-71.11,Cambridge,MA
17076,"Bremen, OH","Bremen, Fairfield County, Ohio, United States",39.7,-82.43,Bremen,OH
17081,"Dixon, CA","Dixon, Solano County, California, 95620, United States",38.45,-121.82,Dixon,CA
17181,"Cedar Bluff, VA","Cedar Bluff, Tazewell County, Virginia, United States",37.09,-81.76,Cedar Bluff,VA
17235,"Stanford, CA","Stanford, Palo Alto, Santa Clara County, California, United States",37.43,-122.17,Stanford,CA
17309,"Jersey Village, TX","Kessler Jersey Village Apartments, Jersey Village, Harris County, 77065, United States",29.9,-95.59,Jersey Village,TX
17332,"Lanham, MD","Lanham, Glenn Dale, Prince George's County, Maryland, 20706, United States",38.97,-76.84,Lanham,MD
17334,"Spring Valley Village, TX","Spring Valley, Harris County, United States",29.79,-95.5,Spring Valley Village,TX
17452,"Ferrisburgh, VT","Ferrisburgh, Addison County, Vermont, United States",44.21,-73.25,Ferrisburgh,VT
17535,"Sparks, NV","Sparks, Washoe County, Nevada, United States",39.54,-119.75,Sparks,NV
17555,"Hurst, TX","Hurst, Tarrant County, Texas, United States",32.82,-97.17,Hurst,TX
17594,"Emeryville, CA","Emeryville, Alameda County, California, 94608, United States",37.83,-122.29,Emeryville,CA
17622,"Williston, VT","Williston, Chittenden County, Vermont, 05495, United States",44.44,-73.07,Williston,VT
17644,"Addison, TX","Addison, Dallas County, Texas, 75001, United States",32.96,-96.83,Addison,TX
17673,"Independence, OH","Independence, Cuyahoga County, Ohio, United States",41.38,-81.64,Independence,OH
17698,"Palms, CA","Palms, Los Angeles, Los Angeles County, California, 90034, United States",34.02,-118.41,Palms,CA
17743,"Temecula, CA","Temecula, Riverside County, California, United States",33.49,-117.15,Temecula,CA
17834,"Arlington Heights, OH","Arlington Heights, Hamilton County, Ohio, United States",39.22,-84.46,Arlington Heights,OH
17840,"Colerain Township, OH","Colerain Township, Hamilton County, Ohio, United States",39.26,-84.63,Colerain Township,OH
17854,"Camas, WA","Camas, Clark County, Washington, 98607, United States",45.59,-122.4,Camas,WA
17911,"Soddy-Daisy, TN","Soddy-Daisy, Hamilton County, East Tennessee, Tennessee, United States",35.24,-85.19,Soddy-Daisy,TN
17939,"Matlacha, FL","Matlacha, Lee County, Florida, United States",26.63,-82.07,Matlacha,FL
18030,"Amherst, NY","Town of Amherst, Erie County, New York, United States",42.98,-78.8,Amherst,NY
18051,"Westlake, TX","Westlake, Denton County, Texas, United States",32.99,-97.19,Westlake,TX
18150,"Parrish, FL","Parrish, Manatee County, Florida, 34219, United States",27.59,-82.43,Parrish,FL
18165,"Newark, OH","Newark, Licking County, Ohio, 43055, United States",40.06,-82.4,Newark,OH
18237,"Highlands Ranch, CO","Highlands Ranch, Douglas County, Colorado, 80126, United States",39.55,-104.97,Highlands Ranch,CO
18257,"Sunnyside, NY","Sunnyside, Queens County, City of New York, New York, 11101, United States",40.74,-73.94,Sunnyside,NY
18264,"West Lake Hills, TX","West Lake Hills, Travis County, Texas, 78746, United States",30.29,-97.81,West Lake Hills,TX
18285,"Coldspring, TX","Coldspring, San Jacinto County, Texas, United States",30.59,-95.13,Coldspring,TX
18373,"Lafayette, IN","Lafayette, Tippecanoe County, Indiana, United States",40.42,-86.88,Lafayette,IN
18489,"Biscayne Park, FL","Biscayne Park, Miami-Dade County, Florida, United States",25.88,-80.18,Biscayne Park,FL
18684,"Cattaraugus, NY","Cattaraugus County, New York, United States",42.22,-78.65,Cattaraugus,NY
18686,"Castroville, TX","Castroville, Medina County, Texas, United States",29.36,-98.88,Castroville,TX
18780,"Everman, TX","Everman, Tarrant County, Texas, 76140, United States",32.63,-97.29,Everman,TX
18862,"Medina, WA","Medina, King County, Washington, 98039, United States",47.62,-122.23,Medina,WA
18988,"Howard Beach, NY","Howard Beach, Queens County, City of New York, New York, 11414, United States",40.66,-73.84,Howard Beach,NY
19094,"Middleburg, FL","Middleburg, Clay County, Florida, United States",30.06,-81.9,Middleburg,FL
19116,"Maxville, FL","Maxville, Jacksonville, Duval County, Florida, United States",30.2,-82.01,Maxville,FL
19122,"Buckeye Lake, OH","Buckeye Lake, Union Township, Licking County, Ohio, 43008, United States",39.93,-82.48,Buckeye Lake,OH
19273,"Fairfax, VA","Fairfax, Fairfax (city), Virginia, 20030, United States",38.85,-77.31,Fairfax,VA
19274,"Stokesdale, NC","Stokesdale, Guilford County, North Carolina, United States",36.24,-79.98,Stokesdale,NC
19296,"Bainbridge Is, WA","Bainbridge Island, Kitsap County, Washington, 98110, United States",47.65,-122.55,Bainbridge Is,WA
19417,"Sherman, NY","Village of Sherman, Town of Sherman, Chautauqua County, New York, 14781, United States",42.16,-79.6,Sherman,NY
19603,"Santa Barbara, CA","Santa Barbara, Santa Barbara County, California, United States",34.42,-119.7,Santa Barbara,CA
19722,"Pfafftown, NC","Pfafftown, Forsyth County, North Carolina, 27040, United States",36.15,-80.36,Pfafftown,NC
19761,"Bristol, VA","Bristol, Virginia, 37625, United States",36.6,-82.19,Bristol,VA
19957,"Other, TX","The Other Bar, 10425, Bauman Road, Hawthorne Place, Houston, Harris County, Texas, 77076, United States",29.86,-95.37,Other,TX
20045,"East Los Angeles, CA","East Los Angeles, Los Angeles County, California, United States",34.02,-118.17,East Los Angeles,CA
20067,"Mercer, ME","Mercer, Somerset County, Maine, United States",44.68,-69.94,Mercer,ME
20196,"Pinedale, CA","Pinedale, Fresno, Fresno County, California, 93650, United States",36.84,-119.79,Pinedale,CA
20364,"Bay Lake, FL","Bay Lake, Reedy Creek Improvement District, Orange County, Florida, 32830, United States",28.39,-81.57,Bay Lake,FL
20418,"Orting, WA","Orting, Pierce County, Washington, 98360, United States",47.1,-122.2,Orting,WA
20582,"Richland Hills, TX","Richland Hills, Tarrant County, Texas, 76118, United States",32.82,-97.23,Richland Hills,TX
20602,"Toluca Lake, CA","Toluca Lake, Los Angeles, Los Angeles County, California, 91602, United States",34.15,-118.36,Toluca Lake,CA
20733,"Whitney, NV","Whitney, Clark County, Nevada, 89112, United States",36.09,-115.04,Whitney,NV
20813,"Bronxville, NY","Village of Bronxville, Town of Eastchester, Westchester County, New York, 10708, United States",40.94,-73.83,Bronxville,NY
20852,"Riverview, FL","Riverview, Hillsborough County, Florida, 33568, United States",27.87,-82.33,Riverview,FL
20904,"Rowan, IA","Rowan, Wright County, Iowa, United States",42.74,-93.55,Rowan,IA
20993,"Adelphi, MD","Adelphi, Prince George's County, Maryland, United States",39.0,-76.97,Adelphi,MD
21103,"Saint Albans Town, VT",,,,Saint Albans Town,VT
21129,"Cleburne, TX","Cleburne, Johnson County, Texas, United States",32.35,-97.39,Cleburne,TX
21310,"Milton, VT","Milton, Chittenden County, Vermont, 05468, United States",44.63,-73.12,Milton,VT
21738,"Waterville, VT","Waterville, Lamoille County, Vermont, 05492, United States",44.69,-72.77,Waterville,VT
21811,"Garden Ridge, TX","Garden Ridge, Comal County, Texas, 78266, United States",29.63,-98.31,Garden Ridge,TX
21865,"Oakwood, GA","Oakwood, Hall County, Georgia, United States",34.23,-83.88,Oakwood,GA
21879,"Minnie, KY","Minnie, Floyd County, Kentucky, 41651, United States",37.47,-82.75,Minnie,KY
21911,"Cold Creek, NV","Cold Creek, Clark County, Nevada, United States",36.41,-115.74,Cold Creek,NV
21914,"Kemah, TX","Kemah, Galveston County, Texas, United States",29.54,-95.02,Kemah,TX
21939,"Menifee, CA","Menifee, Riverside County, California, 92584, United States",33.69,-117.18,Menifee,CA
21994,"Clearwater Beach, FL","Clearwater Beach, Clearwater, Pinellas County, Florida, 33767, United States",27.98,-82.83,Clearwater Beach,FL
22012,"Glenford, OH","Glenford, Perry County, Ohio, United States",39.89,-82.32,Glenford,OH
22096,"Blue Ash, OH","Blue Ash, Hamilton County, Ohio, 45242, United States",39.23,-84.38,Blue Ash,OH
22278,"CHERRYHILLSVILLAGE, CO",,,,CHERRYHILLSVILLAGE,CO
22295,"Ventura, IA","Ventura, Cerro Gordo County, Iowa, 50482, United States",43.13,-93.48,Ventura,IA
22348,"Dickinson, TX","Dickinson, Galveston County, 77539, United States",29.46,-95.05,Dickinson,TX
22442,"Haines City, FL","Haines City, Polk County, Florida, 33844, United States",28.11,-81.63,Haines City,FL
22508,"Kew Gardens Hills, NY","Congregation Young Israel of Kew Gardens Hills, 150th Street, Queens, City of New York, New York, 11367, United States",40.73,-73.82,Kew Gardens Hills,NY
22584,"Hebron, OH","Hebron, Union Township, Licking County, Ohio, 43025, United States",39.96,-82.49,Hebron,OH
22611,"Fife, WA","Fife, Pierce County, Washington, 98424, United States",47.24,-122.36,Fife,WA
22663,"El Sereno, CA","El Sereno, Los Angeles, Los Angeles County, California, 90032, United States",34.08,-118.18,El Sereno,CA
22687,"Belton, TX","Belton, Bell County, Texas, United States",31.06,-97.46,Belton,TX
22751,"Highland Park, MI","Highland Park, Wayne County, Michigan, 48203, United States",42.41,-83.1,Highland Park,MI
22757,"Euless, TX","Euless, Tarrant County, Texas, United States",32.85,-97.07,Euless,TX
22768,"Canutillo, TX","Doniphan Drive, Serene Acres Colonia, Canutillo, El Paso County, 79821, United States",31.91,-106.6,Canutillo,TX
22792,"Stafford, TX","Stafford Run Road, Stafford, Fort Bend County, Texas, 77477, United States",29.61,-95.56,Stafford,TX
22976,"Washingtonville, OH","Washingtonville, Columbiana County, Ohio, 44490, United States",40.9,-80.76,Washingtonville,OH
22979,"Bellerose, NY","Village of Bellerose, Town of Hempstead, Nassau County, New York, United States",40.72,-73.72,Bellerose,NY
23077,"Porter, TX","Gladys Porter Zoo, Polk Street, Brownsville, Cameron County, 78520, United States",25.91,-97.5,Porter,TX
23121,"Saint George, UT","East Saint George Boulevard, St. George, Washington County, Utah, 84771, United States",37.11,-113.57,Saint George,UT
23128,"Lowell, MI","Lowell, Middlesex County, Massachusetts, United States",42.64,-71.31,Lowell,MI
23188,"Ft Worth, TX","Fort Worth, Tarrant County, Texas, United States",32.75,-97.33,Ft Worth,TX
23224,"Sunfield, MI","Sunfield, Sunfield Township, Eaton County, Michigan, United States",42.76,-84.99,Sunfield,MI
23254,"Holland, MI","Holland, Ottawa County, Michigan, 49423, United States",42.79,-86.11,Holland,MI
23288,"Anderson Township, OH","Anderson Township, Hamilton County, Ohio, United States",39.09,-84.34,Anderson Township,OH
23290,"Stockton, NY","Town of Stockton, Chautauqua County, New York, United States",42.32,-79.36,Stockton,NY
23372,"Flint, MI","Flint, Genesee County, Michigan, United States",43.02,-83.69,Flint,MI
23381,"Richmond Hill, NY","Richmond Hill, Queens County, City of New York, New York, 11418, United States",40.7,-73.83,Richmond Hill,NY
23455,"Greenhurst, NY","Greenhurst, Town of Ellery, Chautauqua County, New York, 14742, United States",42.12,-79.31,Greenhurst,NY
23498,"Clintwood, VA","Clintwood, Dickenson County, Virginia, United States",37.15,-82.46,Clintwood,VA
23524,"Reading, PA","Reading, Berks County, Pennsylvania, United States",40.34,-75.93,Reading,PA
23834,"Homestead, FL","Homestead, Miami-Dade County, Florida, United States",25.47,-80.48,Homestead,FL
24045,"Fort Washington, MD","Fort Washington, Prince George's County, Maryland, United States",38.74,-77.0,Fort Washington,MD
24170,"Pt Isabel, TX","Port Isabel, Cameron County, Texas, 78578, United States",26.07,-97.21,Pt Isabel,TX
